ID	Description	Length	GC
CP003157.1	Lactococcus  lactis  subsp.  cremoris  UC509.9  complete  genome	2250427	35.8788798748
CP007605.1	Helicobacter  pylori  strain  BM012B  complete  genome	1659060	38.8762311188
CP002332.1	Helicobacter  pylori  Gambia94/24  complete  genome	1709911	39.1263638868
CP012689.1	Campylobacter  jejuni  subsp.  jejuni  strain  RM3197  complete  genome	1664565	30.5924370631
CP018007.1	Bacillus  velezensis  strain  sx01604  complete  genome	3926520	46.5006927254
CP000036.1	Shigella  boydii  Sb227  complete  genome	4519823	51.2128019172
CP018245.1	Escherichia  coli  strain  472  complete  genome	5513531	50.4998702284
CP000302.1	Shewanella  denitrificans  OS217  complete  genome	4545906	45.1491737841
CP006958.1	UNVERIFIED:  Achromobacter  xylosoxidans  NBRC  15126  =  ATCC  27061  complete  genome	6683584	67.5320157568
CP016684.1	Neisseria  meningitidis  strain  L91543  complete  genome	2173191	51.7226051461
CP000993.1	Borrelia  recurrentis  A1  complete  genome	930981	27.5181770627
CP012083.1	Bordetella  pertussis  strain  I751  complete  genome	4109556	67.7036156704
CP009715.1	Yersinia  pestis  Pestoides  F  complete  genome	4519828	47.6425430348
CP001680.1	Helicobacter  pylori  52  complete  genome	1568826	38.9409023053
CP011188.1	Bordetella  pertussis  strain  H707  complete  genome	4107280	67.706170507
CP010350.1	Acinetobacter  johnsonii  XBB1  complete  genome	3509795	41.4308243074
AM406670.1	Azoarcus  sp.  BH72  complete  genome	4376040	67.9164495754
CP002394.1	Bacillus  cellulosilyticus  DSM  2522  complete  genome	4681672	36.5219519864
CP009709.1	Bacillus  coagulans  DSM  1  =  ATCC  7050  complete  genome	3366995	46.8972481397
CP010897.2	Pandoraea  vervacti  strain  NS15  complete  genome	5636000	63.5537437899
CP008853.1	Bacillus  anthracis  strain  Cvac02  complete  genome	5227170	35.3706881544
CP013676.1	Xanthomonas  oryzae  pv.  oryzae  strain  PXO282  complete  genome	4961996	63.6888058757
CP014924.1	Lactobacillus  paracollinoides  strain  TMW  1.1995  complete  genome	3437918	47.1787285212
CP011442.1	Bordetella  pertussis  strain  B3405  complete  genome	4109988	67.7002463268
CP001074.1	Rhizobium  etli  CIAT  652  complete  genome	4513324	61.6651939901
CP013106.1	Halomonas  huangheensis  strain  BJGMM-B45  complete  genome	4757486	58.5292316152
CP017150.1	Brevibacterium  linens  strain  SMQ-1335  complete  genome	4209935	62.63277224
CP007496.1	Candidatus  Saccharibacteria  oral  taxon  TM7x  complete  genome	705138	44.4532843217
CP016530.1	Salmonella  enterica  subsp.  enterica  serovar  Heidelberg  strain  SA01AB09084001  complete  genome	4751449	52.1918471607
BX072543.1	Tropheryma  whipplei  TW08/27  complete  genome	925938	46.3140080653
AM408590.1	Mycobacterium  bovis  BCG  Pasteur  1173P2  complete  genome	4374522	65.6360397776
CP001900.1	Campylobacter  jejuni  subsp.  jejuni  M1  complete  genome	1616648	30.6010337439
CP013182.1	Staphylococcus  aureus  strain  SA40TW  complete  genome	2771849	32.8999523423
CP017279.1	Enterobacter  ludwigii  strain  EN-119  complete  genome	4857439	54.5959712515
CP017480.1	Luteibacter  rhizovicinus  DSM  16549  strain  LJ96T  complete  genome	4765486	64.7218143123
CP009451.1	Cedecea  neteri  strain  SSMD04  complete  genome	4876443	55.1027459974
CP000611.1	Mycobacterium  tuberculosis  H37Ra  complete  genome	4419977	65.6125133683
AE017308.1	Mycoplasma  mobile  163K  complete  genome	777079	24.9512597818
CP002431.1	Desulfovibrio  aespoeensis  Aspo-2  complete  genome	3629109	62.5619676896
CP007686.1	Listeria  monocytogenes  strain  L2624  complete  genome	2932501	38.0430901814
CP017862.1	Campylobacter  jejuni  strain  FJ3124  complete  genome	1694324	30.5807507891
CP011323.1	Escherichia  coli  strain  SQ171  complete  genome	4599702	50.7752893557
CP009596.1	Bacillus  cereus  strain  3a  complete  genome	5270991	35.4481728388
CP007670.1	Staphylococcus  aureus  strain  M121  complete  genome	2896143	32.8625347574
CP012649.1	Trueperella  pyogenes  strain  2012CQ-ZSH  complete  genome	2295822	59.6693471881
CP010249.1	Bordetella  pertussis  strain  H564  complete  genome	4109554	67.7035756192
CP018237.1	Escherichia  coli  strain  155  complete  genome	5513008	50.5473962672
CP007201.1	Sulfurospirillum  multivorans  DSM  12446  complete  genome	3175729	40.8982630445
CP003338.1	Rickettsia  australis  str.  Cutlack  complete  genome	1296670	32.2546214534
CP015641.1	Pseudomonas  stutzeri  strain  273  complete  genome	5030940	60.284320624
CP014681.1	Kozakia  baliensis  strain  NBRC  16680  complete  genome	2807246	57.5182224857
CP003806.1	Candidatus  Kinetoplastibacterium  galatii  TCC219  complete  genome	822140	32.3586007249
CP003393.1	Rickettsia  prowazekii  str.  BuV67-CWPP  complete  genome	1111445	29.0002654202
AE016853.1	Pseudomonas  syringae  pv.  tomato  str.  DC3000  complete  genome	6397126	58.3988809975
CP013904.1	Bordetella  pertussis  strain  J208  complete  genome	4108471	67.7046034887
CP003885.1	Legionella  pneumophila  subsp.  pneumophila  LPE509  complete  genome	3434224	38.3333178034
CP006863.1	Bacillus  toyonensis  BCT-7112  complete  genome	4940474	35.6033449422
AE014295.3	Bifidobacterium  longum  NCC2705  complete  genome	2256640	60.1198241634
CP010796.1	Carnobacterium  sp.  CP1  complete  genome	2605518	38.1288480832
CP002157.1	Maribacter  sp.  HTCC2170  complete  genome	3868304	36.9774454128
CP016622.1	Parageobacillus  thermoglucosidans  strain  NCIMB  11955  complete  genome	3873105	43.8913997942
CP011206.1	Bordetella  pertussis  strain  I915  complete  genome	4106386	67.7067133971
CP019979.1	Streptococcus  agalactiae  strain  Sag158  complete  genome	2096882	35.6667184896
CP001996.1	Staphylococcus  aureus  subsp.  aureus  ED133  complete  genome	2832478	32.9162662517
CP005493.3	Helicobacter  pylori  UM066  complete  genome	1658047	38.616637526
CP007161.1	Virgibacillus  sp.  SK37  complete  genome	3821074	37.6303363923
CP018840.1	Escherichia  coli  isolate  64  complete  genome	4759716	50.6449544469
CP001127.1	Salmonella  enterica  subsp.  enterica  serovar  Schwarzengrund  str.  CVM19633  complete  genome	4709075	52.1741318624
CP002528.1	Krokinobacter  sp.  4H-3-7-5  complete  genome	3389993	37.2891330454
CP016635.1	Francisella  tularensis  subsp.  novicida  PA10-7858  complete  genome	1978958	32.3639005982
CP000238.1	Baumannia  cicadellinicola  str.  Hc  (Homalodisca  coagulata)  complete  genome	686194	33.2349160733
CP010967.1	Thermotoga  maritima  strain  Tma200  complete  genome	1859582	46.2720116671
CP014252.1	Listeria  monocytogenes  strain  CFSAN023459  complete  genome	3039887	38.0789154334
CP014761.1	Leifsonia  xyli  strain  SE134  complete  genome	3596761	70.2199562328
CP002273.2	Eubacterium  limosum  KIST612  complete  genome	4316707	47.4975021469
CP011805.1	Altererythrobacter  marensis  strain  KCTC  22370  complete  genome	2885033	64.6540611494
CP021434.1	Tumebacillus  sp.  AR23208  complete  genome	5249768	56.0108751472
CP012352.1	Propionibacterium  acnes  strain  PA_15_2_L1  complete  genome	2540008	60.1189445073
CP014991.1	Helicobacter  himalayensis  strain  YS1  complete  genome	1829936	39.8863676107
CP016654.1	Neisseria  meningitidis  strain  M22811  complete  genome	2185698	51.6197114148
CP011372.1	Campylobacter  lari  strain  Slaughter  Beach  complete  genome	1563032	29.844046699
CP011510.1	Mycobacterium  tuberculosis  strain  Beijing  complete  genome	4378588	65.613115461
CP013727.1	Bacillus  amyloliquefaciens  strain  MBE1283  complete  genome	3966922	46.5336601022
CP002054.1	Chlamydia  trachomatis  D-LC  complete  genome	1042520	41.307504892
CP014795.1	Bacillus  licheniformis  strain  SCK  B11  complete  genome	4300706	45.9343419429
CP012375.1	Microcystis  aeruginosa  NIES-2481  complete  genome	4293006	42.9110744313
AP012600.1	Helicobacter  pylori  OK113  DNA  complete  genome	1616617	38.7300764498
CP003060.1	Glaciecola  nitratireducens  FR1064  complete  genome	4134229	42.2986244835
HE965805.1	Bordetella  pertussis  18323  complete  genome	4043846	67.6861829061
CP013080.1	Bordetella  pertussis  strain  E194  complete  genome	4103209	67.7095414833
CP013062.1	Peregrinibacteria  bacterium  RIFOXYA2_FULL_PER-ii_58_14  complete  genome	1248026	58.4785092618
CP006580.1	Enterobacter  cloacae  P101  complete  genome	5369929	54.3801230892
CP001853.1	Bifidobacterium  animalis  subsp.  lactis  BB-12  complete  genome	1942198	60.481320648
CP000697.1	Acidiphilium  cryptum  JF-5  complete  genome	3389227	67.9927310859
CP011208.1	Bordetella  pertussis  strain  J018  complete  genome	4103225	67.7094967983
CP007676.1	Staphylococcus  aureus  strain  HUV05  complete  genome	2842022	32.8030887868
CP007810.1	Xanthomonas  oryzae  pv.  oryzicola  strain  YM15  complete  genome	4430829	64.0530474094
CP002771.1	Marinomonas  posidonica  IVIA-Po-181  complete  genome	3899940	44.2851428484
CP003901.1	Streptococcus  pyogenes  A20  complete  genome	1837281	38.53558601
CP011709.1	Bordetella  pertussis  strain  H864  complete  genome	4106500	67.705442591
CP002444.1	Thermovibrio  ammonificans  HB-1  complete  genome	1682965	52.114868699
CP011479.1	Hoeflea  sp.  IMCC20628  complete  genome	4842322	58.9488679192
CP016826.1	Corynebacterium  pseudotuberculosis  strain  MEX29  complete  genome	2337866	52.1825031888
CP003785.1	Klebsiella  pneumoniae  subsp.  pneumoniae  1084  complete  genome	5386705	57.4139478587
FN597644.1	Bacillus  amyloliquefaciens  DSM7  complete  genome	3980199	46.082344124
CP006979.1	Pseudomonas  monteilii  SB3101  complete  genome	5945120	62.4933054337
CP016537.2	Planococcus  halocryophilus  strain  DSM  24743  complete  genome	3424893	40.0511198452
CP003492.1	Bacillus  sp.  JS  complete  genome	4120406	43.9267635277
FN555004.1	Helicobacter  mustelae  12198  complete  genome	1578097	42.4653237412
CP010556.1	Bacillus  amyloliquefaciens  strain  L-H15  complete  genome	3905973	46.6586942613
AP012978.1	Endosymbiont  of  unidentified  scaly  snail  isolate  Monju  DNA  complete  genome	2597759	65.0571126883
CP012833.1	Salmonella  enterica  subsp.  enterica  serovar  Cerro  str.  CFSAN001588  complete  genome	4651400	52.2857419272
CP020451.1	Streptococcus  salivarius  strain  FDAARGOS_259  complete  genome	2259227	40.1359845646
CP015839.1	Marinobacterium  sp.  ST58-10  complete  genome	5191608	58.7915728614
CP008858.2	Pseudomonas  aeruginosa  strain  F63912  complete  genome	6618768	66.2508188835
CP000781.1	Xanthobacter  autotrophicus  Py2  complete  genome	5308934	67.4646925353
CP000142.2	Pelobacter  carbinolicus  DSM  2380  complete  genome	3665893	55.1137471825
CP009476.1	Bacillus  anthracis  strain  Pasteur  complete  genome	5200082	35.3953841497
CP002002.1	Listeria  monocytogenes  10403S  complete  genome	2903106	38.0319561187
CP012582.1	Pseudomonas  aeruginosa  strain  PA_D21  complete  genome	6639108	66.2141661199
CP007156.1	Corynebacterium  falsenii  DSM  44353  strain  BL  8171  complete  genome	2677607	63.1771951597
AP012035.1	Acidiphilium  multivorum  AIU301  DNA  complete  genome	3749411	67.5791744357
CP015199.1	Chryseobacterium  sp.  IHB  B  10212  strain  IHBB  10212  complete  genome	4843645	34.0445470302
CP001047.1	Mycoplasma  arthritidis  158L3-1  complete  genome	820453	30.7094982894
CP000813.4	Bacillus  pumilus  SAFR-032  complete  genome	3704641	41.2876173427
CP003499.1	Streptococcus  thermophilus  MN-ZLW-002  complete  genome	1848520	39.0570294073
CP002175.1	Halanaerobium  praevalens  DSM  2228  complete  genome	2309262	30.2936176146
CP002508.1	Bacillus  thuringiensis  serovar  finitimus  YBT-020  complete  genome	5355490	35.5394744458
AE009949.1	Streptococcus  pyogenes  MGAS8232  complete  genome	1895017	38.5466198984
CP004345.1	Morganella  morganii  subsp.  morganii  KT  complete  genome	3799539	51.1394408637
CP011263.1	Mycoplasma  mycoides  subsp.  mycoides  strain  Ben326  complete  genome	1109375	23.9583549296
CP012969.1	Psychrobacter  sp.  AntiMn-1  complete  genome	3138120	43.8976839636
CP002056.1	Methylotenera  versatilis  301  complete  genome	3059871	42.6351306967
CP002630.1	Marinithermus  hydrothermalis  DSM  14884  complete  genome	2269167	68.0758181306
CP011748.1	Bordetella  pertussis  strain  I968  complete  genome	4107604	67.7056989914
CP014474.1	Serratia  rubidaea  strain  1122  complete  genome	4922834	59.2026259671
CP017839.1	Nocardia  seriolae  strain  EM150506  complete  genome	8304518	68.0802787109
AP014569.1	Comamonadaceae  bacterium  B1  DNA  complete  genome	2606868	66.0905730555
CP000922.1	Anoxybacillus  flavithermus  WK1  complete  genome	2846746	41.7767514207
CP019646.1	Phycisphaerae  bacterium  SM-Chi-D1  complete  genome	3868357	47.0421680315
CP002735.1	Delftia  sp.  Cs1-4  complete  genome	6685842	66.7179541485
CP014164.1	Aerococcus  viridans  strain  CCUG4311  complete  genome	2199877	39.3756560026
FN645454.1	Bartonella  clarridgeiae  strain  73  complete  genome	1522743	35.7269742826
CP020853.1	Klebsiella  pneumoniae  strain  KPN528  complete  genome	5383018	57.4782399019
CP001839.1	Thermotoga  naphthophila  RKU-10  complete  genome	1809823	46.1407552009
CP002049.1	Truepera  radiovictrix  DSM  17093  complete  genome	3260398	68.1390124764
HF558398.1	Listeria  monocytogenes  serotype  4b  str.  LL195  complete  genome	2904662	38.0376098837
CP003590.1	Pleurocapsa  sp.  PCC  7327  complete  genome	4986817	45.1933367517
CP002305.1	Leadbetterella  byssophila  DSM  17132  complete  genome	4059653	40.4136264848
CP011114.1	Paenibacillus  durus  ATCC  35681  complete  genome	5575484	50.995734182
CP014870.1	Pseudomonas  sp.  A3(2016)  complete  genome	6823539	59.5824835177
CP011043.1	Clavibacter  michiganensis  subsp.  insidiosus  strain  R1-1  complete  genome	3207520	72.9586721205
CP015638.1	Pseudomonas  fluorescens  strain  L111  complete  genome	6606606	60.7757901712
CP001661.1	Geobacter  sp.  M21  complete  genome	4745806	60.4699602133
CP019944.1	Escherichia  coli  strain  DSM  103246  complete  genome	5445834	50.5076173824
AM942759.1	Proteus  mirabilis  strain  HI4320  complete  genome	4063606	38.899686633
CP011117.1	Pseudomonas  fluorescens  strain  LBUM223  complete  genome	6694199	59.4282004464
CP011769.1	Lactobacillus  plantarum  strain  Zhang-LL  complete  genome	2952218	44.9337413429
HG934468.1	Mucinivorans  hirudinis  complete  genome	3149227	44.8991768456
CP018059.1	Moraxella  catarrhalis  strain  CCRI-195ME  complete  genome	1954607	41.6028899927
CP017014.1	Rhodococcus  sp.  WMMA185  complete  genome	4444448	64.0752687398
CP019408.1	Salmonella  enterica  subsp.  enterica  serovar  Crossness  str.  1422-74  complete  genome	4847468	52.2070078647
CP011685.1	Staphylococcus  aureus  strain  ZJ5499  complete  genome	2848095	32.8434971446
CP014492.1	Escherichia  coli  strain  MVAST0167  complete  genome	4806946	50.769261814
CP000083.1	Colwellia  psychrerythraea  34H  complete  genome	5373180	38.0054269539
CP011572.1	Enterobacter  cloacae  strain  CAV1311  complete  genome	4879702	55.3664137687
CP012805.1	Streptococcus  anginosus  strain  J4211  complete  genome	1924513	38.989811968
CP007628.2	Streptococcus  sp.  VT  162  complete  genome	2041142	41.0960628903
CP006838.1	Staphylococcus  aureus  subsp.  aureus  Z172  complete  genome	2987966	32.835882336
CP015002.1	Pseudomonas  aeruginosa  strain  PA8281  complete  genome	6928736	66.0091248967
CP019870.1	Clostridioides  difficile  strain  BR81  complete  genome	4124384	28.7077536912
CP002791.1	Corynebacterium  ulcerans  BR-AD22  complete  genome	2606374	53.3996655891
CP012729.1	Bacillus  anthracis  strain  Parent2  complete  genome	5227092	35.3784666503
AP011548.1	Lactobacillus  rhamnosus  ATCC  53103  DNA  complete  genome	3005051	46.6919197045
CP013952.1	Escherichia  coli  strain  HST04  complete  genome	4567242	50.7862075187
CP009450.1	Pluralibacter  gergoviae  strain  FB2  complete  genome	5489680	59.1055762813
CP010511.1	Campylobacter  jejuni  strain  CJ677CC061  complete  genome	1635130	30.3712854635
CP003715.1	Zymomonas  mobilis  subsp.  mobilis  str.  CP4  =  NRRL  B-14023  complete  genome	2012455	46.235269857
CP013680.1	Pseudomonas  aeruginosa  AES-1R  complete  genome	6343337	66.5121528306
CP009876.1	Klebsiella  pneumoniae  subsp.  pneumoniae  strain  KPNIH31  complete  genome	5228295	57.5106416145
CP013079.1	Bordetella  pertussis  strain  C757  complete  genome	4106366	67.7065804656
CP020712.1	Mycoplasma  pneumoniae  strain  S12-tet-R  complete  genome	816430	40.0102886959
CP013274.1	Bacillus  thuringiensis  strain  CTC  complete  genome	5327397	35.4022987211
CP012091.1	Salmonella  enterica  subsp.  enterica  serovar  Typhi  strain  PM016/13  complete  genome	4793553	52.0318436033
CP001084.2	Lactobacillus  casei  str.  Zhang  complete  genome	2861969	46.5108811451
CP020418.1	Neisseria  gonorrhoeae  strain  FDAARGOS_205  complete  genome	2232393	52.3735740078
CP006751.1	Yersinia  pestis  3770  complete  genome	4523206	47.6364109881
CP010817.1	Myroides  profundi  strain  D25  complete  genome	4064534	33.845798805
HG328254.1	Bacillus  amyloliquefaciens  subsp.  plantarum  UCMB5113  complete  genome	3889532	46.7091670669
CP018102.1	Enterococcus  faecalis  strain  L12  complete  genome	2668255	37.7974743793
CP002215.1	Streptococcus  dysgalactiae  subsp.  equisimilis  ATCC  12394  complete  genome	2159491	39.4978261081
CP000159.1	Salinibacter  ruber  DSM  13855  complete  genome	3551823	66.2167287052
CP019722.1	Lactobacillus  plantarum  strain  CLP0611  complete  genome	3197722	44.5917124753
CP018458.1	Klebsiella  pneumoniae  strain  Kp_Goe_39795  complete  genome	5330835	57.3433430222
CP012111.1	Acetobacter  pasteurianus  strain  Ab3  complete  genome	2806148	53.2811526691
CP016396.1	Mycobacterium  avium  strain  RCAD0278  complete  genome	4953610	69.2942318834
CP011923.1	Francisella  noatunensis  subsp.  orientalis  strain  FNO190  complete  genome	1859595	32.3063892944
CP000108.1	Chlorobium  chlorochromatii  CaD3  complete  genome	2572079	44.278188967
CP015637.1	Pseudomonas  fluorescens  strain  L321  complete  genome	6641144	60.7657054267
CP011726.1	Bordetella  pertussis  strain  I270  complete  genome	4103217	67.7094094707
CP011974.1	Bacillus  endophyticus  strain  Hbe603  complete  genome	4865574	36.6443506974
CP006615.1	Arcobacter  butzleri  7h1h  complete  genome	2253233	27.0598291433
CP001229.1	Sulfurihydrogenibium  azorense  Az-Fu1  complete  genome	1640877	32.7529120099
CP002927.1	Bacillus  amyloliquefaciens  XH7  complete  genome	3939203	45.8209947545
CP002084.1	Dehalogenimonas  lykanthroporepellens  BL-DC-9  complete  genome	1686510	55.0443815928
CP016448.1	Methyloversatilis  sp.  RAC08  complete  genome	3937190	65.0220080819
CP006714.1	Bifidobacterium  breve  NCFB  2258  complete  genome	2315904	58.7122350495
CP021417.1	Corynebacterium  ulcerans  strain  PO100/5  complete  genome	2572413	54.4000904987
CP001633.1	Francisella  tularensis  subsp.  tularensis  NE061598  complete  genome	1892681	32.2600057802
CP003022.1	Pasteurella  multocida  36950  complete  genome	2349518	40.4372726661
CP019015.1	Escherichia  coli  strain  Ecol_AZ162  complete  genome	5099988	50.7351782004
CP014270.1	Escherichia  coli  K-12  strain  DHB4  complete  genome	4546849	50.7454942973
CP013663.1	Escherichia  coli  strain  GB089  complete  genome	5233459	50.7539468638
CP001101.1	Chlorobium  phaeobacteroides  BS1  complete  genome	2736403	48.9270768962
CP020933.1	Escherichia  coli  strain  HB-Coli0  complete  genome	4858944	50.7186129332
CP012546.1	Campylobacter  pinnipediorum  subsp.  pinnipediorum  strain  RM17260  complete  genome	1782665	30.4177733898
CP017331.1	Mycoplasma  pneumoniae  strain  FL8  complete  genome	816491	40.0048500228
CP010437.1	Bifidobacterium  adolescentis  strain  BBMN23  complete  genome	2173720	59.2931012274
CP003085.1	Pantoea  ananatis  PA13  complete  genome	4586378	53.6565237318
CP012034.1	Lactobacillus  ginsenosidimutans  strain  EMML  3041  complete  genome	2590556	36.7071007151
CP000612.1	Desulfotomaculum  reducens  MI-1  complete  genome	3608104	42.2752503808
CP007604.1	Helicobacter  pylori  strain  BM013A  complete  genome	1604233	38.9639784246
CP003738.1	Pseudomonas  putida  HB3267  complete  genome	5875750	62.5983576565
CP020121.1	Comamonas  kerstersii  strain  8943  complete  genome	3547915	59.6315582532
CP007292.2	Salmonella  enterica  subsp.  enterica  serovar  Enteritidis  str.  SA19994216  complete  genome	4685847	52.1670681949
CP007220.1	Mycobacterium  chelonae  CCUG  47445  complete  genome	5029817	63.9201784081
CP002607.1	Aeromonas  veronii  B565  complete  genome	4551783	58.7190338379
CP002007.2	Streptococcus  suis  05HAS68  complete  genome	2176073	41.1648873912
AP012051.1	Caldisericum  exile  AZM16c01  DNA  complete  genome	1558103	35.3748757303
CP007241.1	Streptococcus  pyogenes  strain  1E1  complete  genome	1796152	38.4842151444
CP011360.1	Bradyrhizobium  diazoefficiens  USDA  110  complete  genome	9106064	64.0593894354
CP012731.1	Streptococcus  suis  strain  90-1330  complete  genome	2146151	41.0872301157
CP003323.1	Mycobacterium  intracellulare  MOTT-02  complete  genome	5409696	68.0964327755
CP010319.1	Streptococcus  agalactiae  strain  GBS85147  complete  genome	1996151	35.4872952998
CP003125.1	Geobacillus  thermoleovorans  CCB_US3_UF5  complete  genome	3596620	52.2752195117
CP003989.2	Thioalkalivibrio  nitratireducens  DSM  14787  complete  genome	4002350	66.4973827876
CP002302.1	Buchnera  aphidicola  str.  JF99  (Acyrthosiphon  pisum)  complete  genome	641716	26.2863946045
CP009013.1	Xanthomonas  citri  subsp.  citri  strain  jx4  complete  genome	5124790	64.8390470634
CP011707.1	Bordetella  pertussis  strain  H849  complete  genome	4103204	67.7093559082
CP003215.1	Corynebacterium  diphtheriae  HC04  complete  genome	2484332	53.4535239251
AE017354.1	Legionella  pneumophila  subsp.  pneumophila  str.  Philadelphia  1  complete  genome	3397754	38.269515686
CP000240.1	Synechococcus  sp.  JA-2-3B'a(2-13)  complete  genome	3046682	58.4503404031
CP012681.1	Salmonella  enterica  subsp.  enterica  serovar  Typhimurium  strain  33676  complete  genome	4809574	52.1551596877
CP001744.1	Planctomyces  limnophilus  DSM  3776  complete  genome	5423075	53.6616218658
CP016328.1	Gluconobacter  oxydans  strain  1.637  complete  genome	3606417	56.2476552212
CP020604.1	Lactococcus  lactis  subsp.  lactis  bv.  diacetylactis  strain  FM03  complete  genome	2428349	35.2882966987
CP021487.1	Pediococcus  acidilactici  strain  SRCM100313  complete  genome	2025575	42.2335386248
CP007563.1	Candidatus  Portiera  aleyrodidarum  MED  (Bemisia  tabaci)  strain  BT-Q  complete  genome	357461	26.1222902638
CP015576.1	Campylobacter  hyointestinalis  subsp.  lawsonii  strain  LMG  15993  complete  genome	1753277	33.5485493735
CP013993.1	Pseudomonas  aeruginosa  DHS01  complete  genome	7055752	65.7636776349
CP001872.1	Mycoplasma  gallisepticum  str.  R(high)  complete  genome	1012027	31.4674410861
CP014646.1	Thauera  humireducens  strain  SgZ-1  complete  genome	4171754	66.4205511639
CP017450.1	Klebsiella  sp.  LTGPAF-6F  complete  genome	6174401	55.8716707904
CP004085.1	Corynebacterium  urealyticum  DSM  7111  complete  genome	2316065	64.2358914797
CP016007.1	Escherichia  coli  strain  NGF1  complete  genome	5026105	50.6569600118
CP000127.1	Nitrosococcus  oceani  ATCC  19707  complete  genome	3481691	50.3176186514
CP018816.1	Klebsiella  pneumoniae  strain  AR_0049  complete  genome	5435743	57.2933635751
CP012021.1	Listeria  monocytogenes  strain  CFSAN023463  complete  genome	2939733	37.9833474673
FN298497.1	Lactobacillus  johnsonii  FI9785  complete  genome	1755993	34.4856727789
CP001733.2	Aggregatibacter  actinomycetemcomitans  D11S-1  complete  genome	2105791	44.5531394141
CP016406.1	Salmonella  enterica  subsp.  enterica  serovar  Infantis  strain  FSIS1502169  complete  genome	4727126	52.2718243601
CP006923.1	Klebsiella  pneumoniae  30660/NJST258_1  complete  genome	5263229	57.4157423133
CP010105.1	Candidatus  Sulcia  muelleri  strain  ML  complete  genome	190405	24.0718468528
CP002109.1	Clostridium  saccharolyticum  WM1  complete  genome	4662871	45.0047406415
CP009677.1	Mycoplasma  hominis  strain  AF1  complete  genome	700851	26.9119969865
CP010836.1	Sphingomonas  hengshuiensis  strain  WHSC-8  complete  genome	5191536	66.6979098286
CP017652.1	Acinetobacter  baumannii  strain  KAB06  complete  genome	3967831	39.061441881
CP018701.1	Klebsiella  pneumoniae  strain  Kp_Goe_827024  complete  genome	5374118	57.3591982908
CP011703.1	Bordetella  pertussis  strain  H779  complete  genome	4106294	67.7057219965
CP016952.1	Citrobacter  freundii  strain  SL151  complete  genome	5096586	51.6551471907
CP012154.1	Wenzhouxiangella  marina  strain  KCTC  42284  complete  genome	3675202	65.2557056728
CP003121.1	Streptococcus  pyogenes  MGAS1882  complete  genome	1781029	38.4761842732
CP003122.1	Streptococcus  parasanguinis  FW213  complete  genome	2171609	41.6152723626
CP020835.1	Escherichia  coli  strain  CFSAN051542  complete  genome	4888773	50.9947997176
CP001111.1	Stenotrophomonas  maltophilia  R551-3  complete  genome	4573969	66.2999027759
CP009997.1	Yersinia  kristensenii  strain  Y231  complete  genome	4496569	47.4015632808
CP010479.1	Campylobacter  jejuni  strain  CJ677CC036  complete  genome	1665175	30.3067245184
AP014800.1	Rhodovulum  sulfidophilum  DNA  complete  genome  strain:  DSM  2351	4454432	66.828161256
CP019213.1	Escherichia  coli  strain  WCHEC1613  complete  genome	4671098	50.9144316818
CP012992.1	Klebsiella  pneumoniae  strain  KpN06  complete  genome	5309013	57.4147963096
CP005095.1	Azotobacter  vinelandii  CA6  complete  genome	5323210	65.6451840149
CP000255.1	Staphylococcus  aureus  subsp.  aureus  USA300_FPR3757  complete  genome	2872769	32.7509799779
