ID	Description	Length	GC
CP008925.1	Salmonella  enterica  subsp.  enterica  serovar  Cerro  strain  87  complete  genome	4602439	52.3128280462
AP012052.1	Microbacterium  testaceum  StLB037  DNA  complete  genome	3982034	70.2784054581
CP000485.1	Bacillus  thuringiensis  str.  Al  Hakam  complete  genome	5257091	35.4260940128
CP019413.1	Salmonella  enterica  subsp.  enterica  serovar  Krefeld  str.  SA20030536  complete  genome	4942273	52.0110483577
CP001845.1	Streptococcus  pneumoniae  gamPNI0373  complete  genome	2064154	39.8056540355
CP000252.1	Syntrophus  aciditrophicus  SB  complete  genome	3179300	51.4600383732
AP014633.1	Thioploca  ingrica  DNA  complete  genome	4810005	41.2104769122
CP003591.1	Geitlerinema  sp.  PCC  7407  complete  genome	4681111	58.4630870748
CP014805.2	Elizabethkingia  anophelis  strain  CSID_3015183678  complete  genome	3931222	35.764807991
CP016673.1	Neisseria  meningitidis  strain  M25459  complete  genome	2173115	51.7309944481
CP013913.1	Serratia  fonticola  strain  GS2  complete  genome	6100511	53.7727085485
CP010048.1	Blochmannia  endosymbiont  of  Polyrhachis  (Hedomyrma)  turneri  strain  675  complete  genome	749321	29.0775248525
CP010337.1	Mycobacterium  tuberculosis  strain  22115  complete  genome	4401829	65.5709251768
CP004851.1	Alteromonas  macleodii  str.  'Ionian  Sea  U7'  complete  genome	4442936	44.809625887
CP014689.1	Gluconobacter  albidus  strain  TMW2.1191  complete  genome	3107922	59.7936177291
CP012947.1	Xanthomonas  oryzae  pv.  oryzae  strain  PXO83  complete  genome	5025428	63.7233286399
CP017965.1	Nocardiopsis  dassonvillei  strain  NOCA502F  complete  genome	6585441	72.738697378
CP010050.1	Lactococcus  lactis  subsp.  lactis  strain  S0  complete  genome	2488699	35.2289690316
CP003476.1	Helicobacter  pylori  Aklavik86  complete  genome	1494183	39.2516177737
CP013979.1	Agromyces  aureus  strain  AR33  complete  genome	4373124	70.3925157393
CP004358.1	Candidatus  Portiera  aleyrodidarum  TV  complete  genome	280663	24.6936717701
CP014013.1	Bordetella  bronchiseptica  strain  ATCC:BAA-588D-5  complete  genome	5338656	68.0731629833
CP003278.1	Salmonella  enterica  subsp.  enterica  serovar  Typhi  str.  P-stx-12  complete  genome	4768352	52.0639415882
CP014163.1	Aerococcus  urinaehominis  strain  CCUG42038B  complete  genome	1831400	42.7504095228
CP020581.1	Acinetobacter  baumannii  strain  SSMA17  complete  genome	3932204	39.0721081612
CP009111.1	Rhodococcus  opacus  strain  1CP  complete  genome	7687653	67.4421569236
AP014696.1	Clostridium  botulinum  DNA  complete  genome  strain:  111	3901300	28.2730884577
CP011098.1	Mannheimia  haemolytica  strain  89010807N  complete  genome	2705355	41.0328034583
CP004062.1	Corynebacterium  glutamicum  ZL-6  complete  genome	3332458	54.2506762276
CP001750.1	Bifidobacterium  dentium  Bd1  complete  genome	2636367	58.5366908325
CP009910.1	Borrelia  chilensis  strain  VA1  complete  genome	900694	28.4989130604
CP006912.1	Hyphomicrobium  nitrativorans  NL23  complete  genome	3653837	63.8844042578
CP006870.1	Aeromonas  hydrophila  NJ-35  complete  genome	5279644	60.5122807523
CP002346.1	Riemerella  anatipestifer  DSM  15868  complete  genome	2155121	35.0100992009
CP009085.2	Salmonella  enterica  subsp.  enterica  serovar  Enteritidis  strain  OLF-SE3-98983-4  complete  genome	4679127	52.172488586
CP011487.1	Helicobacter  pylori  strain  PNG84A  complete  genome	1531450	38.7798491626
CP007803.1	Mycobacterium  tuberculosis  K  complete  genome	4385518	65.5911342742
CP002162.1	Micromonospora  aurantiaca  ATCC  27029  complete  genome	7025559	72.8221341533
CP008808.1	Campylobacter  fetus  subsp.  fetus  04/554  complete  genome	1800764	33.2077384932
CP011239.1	Bordetella  pertussis  strain  H915  complete  genome	4104277	67.7083686116
FN543093.2	Cronobacter  turicensis  z3032  complete  genome	4384463	57.4171569015
CP000030.1	Anaplasma  marginale  str.  St.  Maries  complete  genome	1197687	49.7626675417
CP015577.1	Campylobacter  iguaniorum  strain  RM11343  complete  genome	1544095	35.7723456134
CP002336.1	Helicobacter  pylori  SouthAfrica7  complete  genome	1653913	38.4980346608
CP014610.1	Leuconostoc  mesenteroides  subsp.  mesenteroides  strain  BD3749  complete  genome	1986568	37.7612042477
CP000661.1	Rhodobacter  sphaeroides  ATCC  17025  complete  genome	3217726	68.4775210817
CP007474.1	Ehrlichia  sp.  HF  complete  genome	1148904	29.6493875903
CP015876.1	Pseudomonas  putida  SJTE-1  complete  genome	6077201	61.7616728491
CP004025.1	Myxococcus  stipitatus  DSM  14675  complete  genome	10350586	69.1921790708
CP016757.1	Cloacibacillus  porcorum  strain  CL-84  complete  genome	3585187	54.8388131498
CP001663.1	Mycobacterium  smegmatis  str.  MC2  155  complete  genome	6988208	67.4028305969
AE016830.1	Enterococcus  faecalis  V583  complete  genome	3218031	37.5273886423
CP008873.1	Pseudomonas  aeruginosa  strain  F9670  complete  genome	6794354	66.1463179575
CP017658.1	Spiroplasma  sp.  TU-14  complete  genome	1199640	28.7423727118
CP010301.1	Campylobacter  jejuni  subsp.  jejuni  strain  00-0949  complete  genome	1745537	30.4787581128
CP013019.1	Clostridium  pasteurianum  strain  M150B  complete  genome	4351863	29.9354322505
CP003068.1	Streptococcus  pyogenes  Alab49  complete  genome	1827308	38.5798124892
CP014969.1	Salmonella  enterica  subsp.  enterica  serovar  Typhimurium  str.  USDA-ARS-USMARC-1808  complete  genome	4936894	52.1178700616
CP019724.1	Streptomyces  pactum  strain  ACT12  complete  genome	8550793	72.0558666313
CP017458.1	Legionella  pneumophila  subsp.  fraseri  strain  Dallas  1E  complete  genome	3500943	38.2591204713
CP011167.1	Bordetella  pertussis  strain  C571  complete  genome	4105364	67.7077842549
CP011198.1	Bordetella  pertussis  strain  I228  complete  genome	4111652	67.7017899375
CP003592.1	Pseudanabaena  sp.  PCC  7367  complete  genome	4557046	46.3147617996
AP009324.1	Staphylococcus  aureus  subsp.  aureus  Mu3  DNA  complete  genome	2880168	32.8776654695
FO203355.1	Enterobacter  aerogenes  EA1509E  complete  genome	5419609	54.984483198
CP007445.1	Gilliamella  apicola  strain  wkB1  complete  genome	3139412	33.617282472
CP014269.1	Escherichia  coli  B  strain  C3029  complete  genome	4569185	50.8177060023
CP014754.1	Marinobacter  sp.  LQ44  complete  genome	4435564	57.1693024833
AE008923.1	Xanthomonas  axonopodis  pv.  citri  str.  306  complete  genome	5175554	64.7718872221
AP014683.1	Burkholderiales  bacterium  GJ-E10  DNA  complete  genome	3276549	66.2952698098
CP003474.1	Helicobacter  pylori  Shi112  complete  genome	1663456	38.7726516361
CP020586.1	Acinetobacter  baumannii  strain  CBA7  complete  genome	3996455	39.1175929668
CP016653.1	Neisseria  meningitidis  strain  M22748  complete  genome	2157503	51.775038088
CP005975.1	Pseudomonas  fluorescens  PICF7  complete  genome	6136735	60.4020704821
CP013998.1	Synechococcus  sp.  PCC  73109  complete  genome	3025472	49.6049872549
CP013184.1	Pseudomonas  protegens  strain  H78  complete  genome	7032394	63.4033730192
CP008787.1	Campylobacter  jejuni  subsp.  jejuni  strain  MTVDSCj20  complete  genome	1651739	30.5216502123
FM872306.1	Chlamydia  trachomatis  A2497  serovar  A  complete  genome	1044325	41.3028511239
CP000416.1	Lactobacillus  brevis  ATCC  367  complete  genome	2291220	46.2188702962
BX470251.1	Photorhabdus  luminescens  subsp.  laumondii  TTO1  complete  genome	5688987	42.825357133
AP010953.1	Escherichia  coli  O26:H11  str.  11368  DNA  complete  genome	5697240	50.6848228265
CP013322.1	Klebsiella  pneumoniae  strain  CAV1193  complete  genome	5319154	57.5749263887
CP009208.1	Klebsiella  pneumoniae  subsp.  pneumoniae  strain  ATCC  43816  KPPR1  complete  genome	5374834	57.3698090025
CP006798.1	Klebsiella  pneumoniae  subsp.  pneumoniae  PittNDM01  complete  genome	5348284	57.5020885204
CP014129.1	Pantoea  agglomerans  strain  FDAARGOS_160  complete  genome	4050093	55.3681113002
CP016079.1	Mesorhizobium  loti  NZP2037  complete  genome	7007326	62.9273420417
CP002164.1	Caldicellulosiruptor  obsidiansis  OB47  complete  genome	2532343	35.2432905021
CP011270.1	Planctomyces  sp.  SH-PL14  complete  genome	8442773	65.559313273
CP009768.1	Salmonella  enterica  subsp.  enterica  serovar  Enteritidis  strain  FORC_007  complete  genome	4680477	52.1766691728
CP011972.2	Pseudomonas  syringae  pv.  actinidiae  ICMP  18884  complete  genome	6555569	58.415341216
CP012506.2	Mycobacterium  tuberculosis  strain  SCAID  187.0  complete  genome	4411829	65.5984626784
CP001801.1	Halothiobacillus  neapolitanus  c2  complete  genome	2582886	54.7136420268
CP016652.1	Neisseria  meningitidis  strain  M08001  complete  genome	2162199	51.775437876
CP021338.1	Bacillus  velezensis  strain  ZL918  complete  genome	3922711	46.4956250919
CP011766.1	Bordetella  pertussis  strain  J100  complete  genome	4109710	67.7037309202
CP000931.1	Shewanella  halifaxensis  HAW-EB4  complete  genome	5226917	44.5908745059
CP013590.1	Rhizobium  sp.  N871  complete  genome	4476778	61.342175109
CP000154.2	Paenibacillus  polymyxa  E681  complete  genome	5394883	45.7901311298
CP004063.1	Enterococcus  faecium  NRRL  B-2354  complete  genome	2635572	38.0270013492
CP006941.2	Paenibacillus  polymyxa  CR1  complete  genome	6019882	45.5762089689
CP017886.1	Pseudomonas  frederiksbergensis  strain  ERDD5:01  complete  genome	5747498	58.7276237417
CP015515.1	Rathayibacter  tritici  strain  NCPPB  1953  complete  genome	3354681	69.4815095683
CP011272.1	Pirellula  sp.  SH-Sr6A  complete  genome	6534136	54.2473098203
CP015500.1	Klebsiella  pneumoniae  strain  SKGH01  complete  genome	5490611	57.2910373727
CP010089.1	Bacillus  thuringiensis  serovar  galleriae  strain  HD-29  complete  genome	5701188	35.285856211
CP016189.1	Mycobacterium  immunogenum  strain  FLAC016  complete  genome	5604845	64.2631152155
CP003402.1	Francisella  noatunensis  subsp.  orientalis  str.  Toba  04  complete  genome	1847202	32.2162925332
FN557490.1	Listeria  seeligeri  serovar  1/2b  str.  SLCC3954  complete  genome	2797636	37.3826330516
CP017042.1	Selenomonas  sp.  oral  taxon  920  strain  W5150  complete  genome	2374300	56.0427915596
CP010842.1	Bordetella  pertussis  strain  H489  complete  genome	4106364	67.7066377944
CP012591.1	Candidatus  Profftella  armatura  strain  YCPA  complete  genome	457565	24.2719613607
AE017126.1	Prochlorococcus  marinus  subsp.  marinus  str.  CCMP1375  complete  genome	1751080	36.4421385659
CP012097.1	Serratia  plymuthica  strain  3Re4-18  complete  genome	5439574	56.2358743534
CP006811.1	Lactobacillus  johnsonii  N6.2  complete  genome	1887251	34.4832775291
CP002074.1	Helicobacter  pylori  PeCan4  complete  genome	1629557	38.9424242294
CP011868.1	Pseudonocardia  sp.  HH130629-09  complete  genome	6058802	73.6131664313
CP006270.1	Synechococcus  sp.  KORDI-49  complete  genome	2585813	61.3677787218
CP011535.2	Streptococcus  pyogenes  strain  M28PF1  complete  genome	1896976	38.3516712916
CP016373.1	Elizabethkingia  anophelis  strain  3375  complete  genome	4006214	35.7064050997
CP013901.1	Bordetella  pertussis  strain  J175  complete  genome	4106390	67.70659874
CP000964.1	Klebsiella  pneumoniae  342  complete  genome	5641239	57.2861032833
CP014955.1	Mycobacterium  abscessus  strain  FLAC013  complete  genome	5074222	64.1339894076
CP019698.1	Desulfotomaculum  ferrireducens  strain  GSS09  complete  genome	3240180	45.3790838781
CP013197.1	Spiroplasma  citri  strain  R8-A2  complete  genome	1599709	25.56233665
CP011022.1	Mycobacterium  sp.  NRRL  B-3805  complete  genome	5421338	66.8855179293
CP013131.1	Porphyromonas  gingivalis  A7A1-28  complete  genome	2249024	48.579428232
AP012549.1	Cyanobacterium  endosymbiont  of  Epithemia  turgida  isolate  EtSB  Lake  Yunoko  DNA  complete  genome	2794318	33.4134840773
CP009007.1	Xanthomonas  citri  subsp.  citri  strain  mf20  complete  genome	5175551	64.7720213751
CP006822.1	Helicobacter  pylori  oki128  complete  genome	1553826	38.9725747928
CP003795.1	Chlamydia  psittaci  M56  complete  genome	1161385	38.7884293322
CP013886.1	Bordetella  pertussis  strain  J099  complete  genome	4112678	67.7007293058
CP014693.1	Pseudomonas  brassicacearum  strain  L13-6-12  complete  genome	6715909	60.9174126689
CP012744.1	Klebsiella  pneumoniae  subsp.  pneumoniae  strain  TGH10  complete  genome	5355459	57.2524595931
CP003328.1	Pasteurella  multocida  subsp.  multocida  str.  HB03  complete  genome	2307684	40.3602919637
HG738868.1	Serratia  marcescens  SMB2099  complete  genome	5123091	60.046522695
FN434113.1	Erwinia  amylovora  CFBP1430  complete  genome	3805573	53.6019411531
CP008913.1	Corynebacterium  sp.  ATCC  6931  complete  genome	2471920	58.6272209457
CP021426.1	Lactobacillus  rhamnosus  strain  4B15  complete  genome	3047840	46.6239041419
CP010461.1	Campylobacter  jejuni  strain  CJ677CC013  complete  genome	1642694	30.2938343964
CP016030.2	Legionella  pneumophila  strain  OLDA  complete  genome	3486107	38.3555065866
CP003588.1	Pseudomonas  putida  ND6  complete  genome	6085449	61.7726152992
CP003494.1	Mycobacterium  bovis  BCG  str.  ATCC  35743  complete  genome	4334064	65.6510148443
CP009922.2	Streptomyces  xiamenensis  strain  318  complete  genome	5961401	72.0226168312
CP003697.1	Corynebacterium  halotolerans  YIM  70093  =  DSM  44683  complete  genome	3135752	68.4445708717
CP010804.1	Candidatus  Liberibacter  asiaticus  strain  A4  complete  genome	1233514	36.4025864319
CP018154.1	Sphingopyxis  sp.  LPB0140  complete  genome	2533041	46.11970355
CP007490.1	Candidatus  Rhodoluna  lacicola  strain  MWH-Ta8  complete  genome	1430433	51.5268453678
CP018335.1	Clostridium  kluyveri  strain  JZZ  complete  genome	4454353	31.5565021452
CP003801.1	Alpha  proteobacterium  HIMB59  complete  genome	1410127	32.2633351464
CP003513.1	Mycoplasma  gallisepticum  NC08_2008.031-4-3P  complete  genome	926650	31.5942373064
AP014944.1	Staphylococcus  schleiferi  DNA  complete  genome  strain:  TSCC54	2528077	35.8528636588
CP011697.1	Bordetella  pertussis  strain  H763  complete  genome	4110595	67.7052835417
HG004426.1	Campylobacter  fetus  subsp.  venerealis  str.  84-112  complete  genome	1926886	33.3430208118
AM920689.1	Xanthomonas  campestris  pv.  campestris  complete  genome  strain  B100	5079002	65.0416164435
CP016680.1	Neisseria  meningitidis  strain  M22822  complete  genome	2173901	51.6676242386
CP021339.1	Escherichia  coli  strain  95NR1  complete  genome	5467988	50.5838162044
CP007154.1	Mycoplasma  bovoculi  M165/69  complete  genome	760240	28.2166158055
CP000703.1	Staphylococcus  aureus  subsp.  aureus  JH9  complete  genome	2906700	32.9493927822
CP009704.1	Yersinia  pestis  strain  Harbin35  complete  genome	4531804	47.5882672772
CP014670.1	Escherichia  coli  strain  CFSAN004177  complete  genome	5191331	50.4655164543
CP011101.1	Bacillus  sp.  LM  4-2  complete  genome	4069266	43.8312707992
CP000539.1	Acidovorax  sp.  JS42  complete  genome	4448856	66.1724722041
CP003486.1	Helicobacter  pylori  HUP-B14  complete  genome	1599280	39.0553248962
CP002806.1	Chlamydophila  psittaci  02DC15  complete  genome	1172182	39.055112602
CP011348.1	Mycoplasma  bovis  strain  NM2012  complete  genome	990348	29.2935412602
CP017595.1	Mycobacterium  tuberculosis  strain  Beijing-like/38774  complete  genome	4431885	65.6040262778
AP012292.1	Selenomonas  ruminantium  subsp.  lactilytica  TAM6421  DNA  complete  genome	3003680	50.6781348213
AP012202.1	Candidatus  Arthromitus  sp.  SFB-mouse-Japan  DNA  complete  genome	1620005	28.2602214191
CP011077.1	Klebsiella  michiganensis  strain  RC10  complete  genome	5107633	54.889417466
AP012492.1	Helicobacter  cinaedi  CCUG  18818  =  ATCC  BAA-847  DNA  complete  genome	2240130	38.3434889939
CP013934.1	Weissella  cibaria  strain  CMS3  complete  genome	2342907	45.3182307279
CP015529.1	Rhodococcus  sp.  WB1  complete  genome	5924026	70.6262430313
AP012222.1	Sphingobium  sp.  SYK-6  DNA  complete  genome	4199332	65.5695001014
AE002098.2	Neisseria  meningitidis  MC58  complete  genome	2272360	51.5278388988
CP001816.1	Sulfurospirillum  deleyianum  DSM  6946  complete  genome	2306351	38.9698272292
CP011278.1	Bacillus  amyloliquefaciens  strain  L-S60  complete  genome	3903017	46.6606986339
CP000487.1	Campylobacter  fetus  subsp.  fetus  82-40  complete  genome	1773615	33.3075103672
CP001056.1	Clostridium  botulinum  B  str.  Eklund  17B  complete  genome	3800327	27.5113694164
CP003397.1	Rickettsia  typhi  str.  TH1527  complete  genome	1112372	28.9189228064
CP010333.1	Mycobacterium  microti  strain  12  complete  genome	4370115	65.6294170748
HE601808.1	Chlamydia  trachomatis  Ia/SotonIa1  complete  genome	1042630	41.3097647296
CP000800.1	Escherichia  coli  E24377A  complete  genome	4979619	50.6216238632
CP010802.1	Desulfuromonas  sp.  WTL  complete  genome	3958620	61.1911979427
CP016944.1	Yersinia  enterocolitica  strain  YE3  complete  genome	4664930	46.9532233067
CP012157.1	Betaproteobacteria  bacterium  UKL13-2  complete  genome	3387087	54.9769167429
CP002399.1	Micromonospora  sp.  L5  complete  genome	6962533	72.8375003752
CP014170.1	Clostridium  tyrobutyricum  strain  KCTC  5387  complete  genome	3071606	31.0812975362
CP012095.1	Mycobacterium  bovis  strain  1595  complete  genome	4351712	65.6386957593
CP005996.1	Cycloclasticus  zancles  78-ME  complete  genome	2613078	41.8372892045
CP016668.1	Neisseria  meningitidis  strain  M25472  complete  genome	2170146	51.7229255543
CP013745.1	Arthrobacter  sp.  A3  complete  genome	4264061	60.7814240931
CP012483.1	Bacillus  cereus  strain  NJ-W  complete  genome	5370032	35.2236262279
CP001582.1	Helicobacter  pylori  v225d  complete  genome	1588278	38.97239652
CP017305.1	Chlorobaculum  limnaeum  strain  DSM  1677  complete  genome	2797276	56.3880718242
CP010228.1	Escherichia  coli  strain  S3  complete  genome	4632368	50.6615838811
CP012149.1	Campylobacter  jejuni  strain  CJM1cam  complete  genome	1616662	30.601387303
CP000850.1	Salinispora  arenicola  CNS-205  complete  genome	5786361	69.5185281388
CP016279.1	Streptomyces  griseochromogenes  strain  ATCC  14511  complete  genome	10764674	70.7562625677
CP006818.1	Zymomonas  mobilis  subsp.  mobilis  str.  CP4  =  NRRL  B-14023  complete  genome	1998637	46.2420139325
FN869568.1	Halomonas  elongata  DSM  2581  complete  genome	4061296	63.6084638992
CP018948.1	Escherichia  coli  strain  Ecol_224  complete  genome	4891786	50.6641132707
CP018115.1	Escherichia  coli  strain  MRSN346638  complete  genome	4798436	50.8214134772
CP003735.1	Marinobacter  sp.  BSs20148  complete  genome	4063864	54.1346856096
CP016861.1	Staphylococcus  aureus  subsp.  aureus  strain  1969.N  complete  genome	2864628	32.7971031492
CP007181.1	Campylobacter  coli  RM4661  complete  genome	1824273	31.1476955478
CP007142.1	Gynuella  sunshinyii  YC6258  complete  genome	6475959	48.6327816467
CP011304.1	Microcystis  aeruginosa  NIES-2549  complete  genome	4294213	42.9151045838
AP009378.1	Escherichia  coli  SE15  DNA  complete  genome	4717338	50.7384249337
CP013130.1	Lactobacillus  paraplantarum  strain  L-ZS9  complete  genome	3139729	43.9522328201
CP010148.1	Escherichia  coli  strain  D6  complete  genome	4711358	50.8936276972
CP008943.1	Yersinia  pseudotuberculosis  strain  ATCC  6904  complete  genome	4806594	47.5998180832
CP003208.1	Corynebacterium  diphtheriae  INCA  402  complete  genome	2449071	53.6508741478
CP006671.1	Chlamydia  trachomatis  strain  F/1-93  complete  genome	1042588	41.3073045153
CP011737.1	Bordetella  pertussis  strain  I382  complete  genome	4110505	67.7036033285
CP002548.1	Strawberry  lethal  yellows  phytoplasma  (CPA)  str.  NZSb11  complete  genome	959779	27.1914680359
CP003234.1	Mycobacterium  tuberculosis  RGTB423  complete  genome	4406587	65.618538792
CP014665.1	Salmonella  enterica  subsp.  enterica  serovar  Anatum  str.  USDA-ARS-USMARC-1766  complete  genome	4751034	52.1951011085
CP011762.1	Bordetella  pertussis  strain  J076  complete  genome	4105464	67.7065491258
CP002271.1	Stigmatella  aurantiaca  DW4/3-1  complete  genome	10260756	67.4586453474
CP003282.1	Spirochaeta  africana  DSM  8902  complete  genome	3285855	57.7661521887
CP002390.1	Filifactor  alocis  ATCC  35896  complete  genome	1931012	35.4455073298
CP011770.1	Croceicoccus  naphthovorans  strain  PQ-2  complete  genome	3543806	62.6024392983
CP002352.1	Bacteroides  helcogenes  P  36-108  complete  genome	3998906	44.717455224
CP007131.1	Chlamydia  trachomatis  D/CS637/11  complete  genome	1042680	41.308071508
CP016191.1	Mycobacterium  abscessus  strain  FLAC030  complete  genome	4867257	64.2339206662
CP003483.1	Helicobacter  pylori  Aklavik117  complete  genome	1614447	38.8000349346
CP012479.1	Arthrobacter  sp.  ERGS1:01  complete  genome	4030317	65.6559769368
CP006939.1	Salinispira  pacifica  strain  L21-RPul-D2  complete  genome	3782798	51.8603425295
CP017374.1	Lactobacillus  plantarum  strain  TMW  1.708  complete  genome	3133208	44.707501066
CP006680.1	Chlamydia  trachomatis  strain  J/31-98  complete  genome	1043207	41.3091553258
AE000783.1	Borrelia  burgdorferi  B31  complete  genome	910724	28.5936244131
CP016449.1	Hydrogenophaga  sp.  RAC07  complete  genome	4674684	65.5079145457
CP002047.1	Streptomyces  bingchenggensis  BCW-1  complete  genome	11936683	70.7545890261
AP012551.1	Plautia  stali  symbiont  DNA  complete  genome	4035456	56.9571072018
CP010523.2	Klebsiella  variicola  strain  DSM  15968  complete  genome	5521203	57.5604084834
CP016223.1	Candidatus  Sulcia  muelleri  strain  NC  complete  genome	192244	23.7318199788
CP005078.1	Spiroplasma  syrphidicola  EA-1  complete  genome	1107344	29.2010432169
CP011342.2	Escherichia  coli  K-12  GM4792  Lac+  complete  genome	4622342	50.8098492063
CP009991.1	Yersinia  pestis  strain  Nicholisk  41  complete  genome	4523033	47.5788701962
CP016640.1	Mycobacterium  sp.  djl-10  complete  genome	6395946	67.9372996583
CP002541.1	Sphaerochaeta  globosa  str.  Buddy  complete  genome	3316466	48.8743439553
CP007482.1	Streptococcus  agalactiae  138P  complete  genome	1838701	35.4730323201
AE008691.1	Thermoanaerobacter  tengcongensis  MB4  complete  genome	2689445	37.5709114706
CP013877.1	Bordetella  pertussis  strain  H348  complete  genome	4106382	67.7067793498
CP010327.1	Myroides  sp.  A21  complete  genome	4155464	34.0793711605
CP003903.1	Candidatus  Blochmannia  chromaiodes  str.  640  complete  genome	791219	29.4522755394
CP002096.1	Helicobacter  pylori  35A  complete  genome	1566655	38.8670766697
CP014620.1	Salmonella  enterica  subsp.  enterica  serovar  Anatum  str.  USDA-ARS-USMARC-1676  complete  genome	4676958	52.2397464335
CP008724.1	Staphylococcus  xylosus  strain  SMQ-121  complete  genome	2757557	32.8764555003
CP019208.1	Enterococcus  faecium  strain  2014-VREF-41  complete  genome	3009007	37.773690789
CP017087.1	Enterobacter  sp.  HK169  complete  genome	4551186	56.153033517
CP017241.1	Rhizobium  etli  8C-3  complete  genome	4186145	59.9296966541
HG322950.1	Pseudomonas  knackmussii  B13  complete  genome	6162905	65.610763106
CP003065.1	Clostridium  clariflavum  DSM  19732  complete  genome	4897678	35.7171704632
CP017289.1	Klebsiella  variicola  strain  GJ3  complete  genome	5599927	57.2698715537
CP002512.1	Aerococcus  urinae  ACS-120-V-Col10a  complete  genome	2080974	41.8828875325
CP001095.1	Bifidobacterium  longum  subsp.  infantis  ATCC  15697  complete  genome	2832748	59.8631434918
CP002703.1	Buchnera  aphidicola  str.  F009  (Myzus  persicae)  complete  genome	643510	25.4386101226
CP007219.1	Amycolatopsis  lurida  NRRL  2430  complete  genome	8987656	68.709004884
CP001561.1	Neisseria  meningitidis  alpha710  complete  genome	2242947	51.690209354
CP015229.1	Escherichia  coli  strain  06-00048  complete  genome	5498453	50.6032514964
CP014841.1	Dyella  thiooxydans  strain  ATSB10  complete  genome	4227172	67.9802004745
HE983624.1	Streptococcus  pneumoniae  SPNA45  complete  genome	2129934	39.7882751297
CP001998.1	Coraliomargarita  akajimensis  DSM  45221  complete  genome	3750771	53.6017794741
CP011394.1	Salmonella  enterica  subsp.  enterica  serovar  Enteritidis  str.  18569  complete  genome	4685993	52.1669793361
AP012027.1	Erysipelothrix  rhusiopathiae  str.  Fujisawa  DNA  complete  genome	1787941	36.5562398312
CP001321.1	Haemophilus  parasuis  SH0165  complete  genome	2269156	39.9931075695
CP017180.1	Enterobacter  hormaechei  subsp.  oharae  strain  DSM  16687  complete  genome	4724316	55.5811465617
CP012580.1	Pseudomonas  aeruginosa  strain  PA_D9  complete  genome	6645477	66.2098898243
CP019865.1	Dehalococcoides  mccartyi  strain  KBTCE2  complete  genome	1329198	49.1394811006
CP019417.1	Salmonella  enterica  subsp.  enterica  serovar  Wandsworth  str.  SA20092095  complete  genome	4916040	52.1685136817
CP014538.1	Acinetobacter  baumannii  strain  XH860  complete  genome	3846621	39.0161910934
CP009278.1	Sphingobacterium  sp.  ML3W  complete  genome	5329010	37.0270462994
CP020597.1	Acinetobacter  baumannii  strain  HWBA8  complete  genome	4077713	39.0437237736
CP002825.1	Lacinutrix  sp.  5H-3-7-4  complete  genome	3296168	30.8232165351
CR626927.1	Bacteroides  fragilis  NCTC  9343  complete  genome	5205140	43.1905770066
CP015607.1	Bacillus  safensis  strain  U14-5  complete  genome	4070488	41.4088433623
CP003126.1	Thermus  sp.  CCB_US3_UF1  complete  genome	2243772	68.6059457021
CP016018.1	Escherichia  coli  strain  ER1821R  complete  genome	4595577	50.831962994
CP006688.1	Campylobacter  jejuni  subsp.  jejuni  NCTC  11168-mfK12E5  complete  genome	1641469	30.5487340912
CP010989.1	Pseudonocardia  sp.  EC080625-04  complete  genome	6135769	73.8363683509
CP012579.1	Pseudomonas  aeruginosa  strain  PA_D5  complete  genome	6681992	66.1592980057
