ID	Description	Length	GC
CP015945.1	Legionella  pneumophila  strain  C11_O  complete  genome	3416875	38.2935869764
CP009872.1	Klebsiella  pneumoniae  subsp.  pneumoniae  strain  KPNIH30  complete  genome	5306618	57.4415380945
CP015343.1	Legionella  pneumophila  strain  D-7631  complete  genome	3436178	38.3418146557
BX936398.1	Yersinia  pseudotuberculosis  IP32953  genome  complete  sequence	4744671	47.6103822583
CP015184.1	Corynebacterium  pseudotuberculosis  strain  33  complete  genome	2403550	52.0805891286
CP012351.1	Propionibacterium  acnes  strain  PA_21_1_L1  complete  genome	2560354	60.0104516797
CP001736.1	Kribbella  flavida  DSM  17836  complete  genome	7579488	70.5679064338
CP001657.1	Pectobacterium  carotovorum  subsp.  carotovorum  PC1  complete  genome	4862913	51.9317536629
CP020825.1	Salmonella  enterica  subsp.  enterica  strain  CFSAN033543  complete  genome	4679401	52.1729170037
CP013089.1	Bordetella  pertussis  strain  J179  complete  genome	4113730	67.6998247333
CP012151.1	Salmonella  enterica  subsp.  enterica  serovar  Typhi  strain  B/SF/13/03/195  complete  genome	4798993	52.0286443427
CP013113.1	Pseudomonas  aeruginosa  strain  PAER4_119  complete  genome	6504659	66.37337945
CP002563.1	Carnobacterium  sp.  17-4  complete  genome	2635294	35.2518542523
CP019946.1	Dehalococcoides  mccartyi  strain  KBDCA3  complete  genome	1337486	47.5885355062
CP007261.1	Salmonella  enterica  subsp.  enterica  serovar  Enteritidis  str.  EC20110357  complete  genome	4678418	52.1701139146
CP006706.1	Staphylococcus  aureus  subsp.  aureus  6850  complete  genome	2736560	32.7833484375
CP015430.1	[Haemophilus]  ducreyi  strain  GHA2  complete  genome	1634243	37.8824324167
CP013185.1	Escherichia  coli  strain  FORC_029  complete  genome	5189944	50.7217611597
CP015448.1	Aeromonas  veronii  strain  CB51  complete  genome	4584103	58.5808390431
AL111168.1	Campylobacter  jejuni  subsp.  jejuni  NCTC  11168  complete  genome	1641481	30.5485716862
CP002472.1	Bacillus  coagulans  2-6  complete  genome	3073079	47.292048138
CP018957.1	Escherichia  coli  strain  Ecol_316  complete  genome	5056072	50.6427519228
HG969191.1	Bartonella  henselae  complete  genome  strain  BM1374165	1975503	38.088628567
CP003308.1	Rickettsia  philipii  str.  364D  complete  genome	1287740	32.4687436905
CP013093.1	Bordetella  pertussis  strain  J194  complete  genome	4106379	67.7069262238
CP004354.1	Corynebacterium  callunae  DSM  20147  complete  genome	2839551	52.3910998605
CP003932.1	Francisella  tularensis  subsp.  holarctica  F92  complete  genome	1886888	32.1719678116
CP014070.1	Citrobacter  amalonaticus  strain  FDAARGOS_165  complete  genome	5030517	53.1874159256
BK006741.1	TPA_asm:  Francisella  tularensis  subsp.  holarctica  OSU18  complete  genome	1895727	32.1581113736
CP011131.1	Lysobacter  gummosus  strain  3.2.11  complete  genome	6056618	66.5338477678
CP000569.1	Actinobacillus  pleuropneumoniae  L20  serotype  5b  complete  genome	2274482	41.2995134716
CP002955.1	Cyclobacterium  marinum  DSM  745  complete  genome	6221273	38.1460675331
CP013211.1	Candidatus  Nasuia  deltocephalinicola  strain  PUNC  complete  genome	112031	16.6168292705
CP020105.1	Spirosoma  rigui  strain  KCTC  12531  complete  genome	5828404	54.4263232267
CP002994.1	Streptomyces  violaceusniger  Tu  4113  complete  genome	10657107	70.9692696151
CP018024.1	Alteromonas  mediterranea  strain  CP48  complete  genome	4324292	44.9488378676
CP013261.1	Corynebacterium  pseudotuberculosis  strain  MB14  complete  genome	2370761	52.0963100034
CP003790.1	Chlamydia  psittaci  84/55  complete  genome	1172064	39.0622013815
CP019633.1	Phycisphaerae  bacterium  L21-RPul-D3  complete  genome	2951611	46.2024297917
CP012109.1	Myxococcus  hansupus  strain  mixupus  complete  genome	9490432	69.1669357096
CP016438.1	Streptomyces  lincolnensis  strain  NRRL  2936  complete  genome	10319054	71.0104240176
CP010114.1	Mycobacterium  avium  subsp.  paratuberculosis  strain  E93  complete  genome	4786065	69.3115534369
CP013237.1	Streptococcus  mutans  strain  NG8  complete  genome	1984441	36.8947728857
CP011618.1	Klebsiella  oxytoca  strain  CAV1335  complete  genome	6229565	54.9147332117
CP010288.1	Francisella  tularensis  subsp.  holarctica  strain  VT68  complete  genome	1893733	32.1571203543
CP002301.1	Buchnera  aphidicola  str.  TLW03  (Acyrthosiphon  pisum)  complete  genome	641770	26.2980507035
AM295250.1	Staphylococcus  carnosus  subsp.  carnosus  TM300  complete  genome	2566424	34.6327029361
CP011073.1	Bacteroides  fragilis  strain  BOB25  complete  genome	5282232	43.187633561
CP017151.1	Lactobacillus  fermentum  strain  NCC2970  complete  genome	1949874	52.2107069482
CP010289.1	Francisella  tularensis  subsp.  holarctica  strain  425  complete  genome	1894186	32.1497466458
CP009010.1	Xanthomonas  citri  subsp.  citri  strain  jx5  complete  genome	5124810	64.838930614
CP019788.1	Bartonella  sp.  JB63  complete  genome	1493693	35.3331641776
CP001615.1	Exiguobacterium  sp.  AT1b  complete  genome	2999895	48.4625628564
AE015450.2	Mycoplasma  gallisepticum  str.  R(low)  complete  genome	1012800	31.469885466
CP007641.1	Rhizobium  etli  bv.  phaseoli  str.  IE4803  complete  genome	4598466	61.4291592022
CP018323.1	Escherichia  coli  strain  9  complete  genome	4855460	50.681006537
CP001287.1	Cyanothece  sp.  PCC  8801  complete  genome	4679413	39.7611409807
CP002746.1	Borrelia  bissettii  DN127  complete  genome	900755	28.7028104201
CP010820.1	Lysinibacillus  fusiformis  strain  RB-21  complete  genome	4843789	37.6216016016
CP014335.1	Geobacillus  thermoleovorans  strain  KCTC  3570  complete  genome	3450609	52.3909257757
CP020438.1	Streptococcus  equinus  strain  FDAARGOS_251  complete  genome	2074802	39.8943610041
CP019699.1	Novibacillus  thermophilus  strain  SG-1  complete  genome	3629225	50.4437448767
CP015109.1	Sporosarcina  ureae  strain  P17a  complete  genome	3412428	41.5059013699
CP019786.1	Bartonella  sp.  Raccoon60  complete  genome	1615700	36.0741474284
HE774679.1	Bacillus  amyloliquefaciens  subsp.  plantarum  YAU  B9601-Y2  complete  genome	4242774	45.8546931795
CP003130.1	Granulicella  mallensis  MP5ACTX8  complete  genome	6237577	57.9098742989
AP006861.1	Chlamydia  felis  Fe/C-56  Fe/C-56  DNA  complete  genome	1166239	39.3753767452
BA000043.1	Geobacillus  kaustophilus  HTA426  DNA  complete  genome	3544776	52.0861967019
CP020108.1	Klebsiella  pneumoniae  strain  AR_0098  complete  genome	5407749	57.3586532955
CP001617.1	Lactobacillus  plantarum  JDM1  complete  genome	3197759	44.6609015876
CU459141.1	Acinetobacter  baumannii  str.  AYE  complete  genome	3936291	39.3799899448
CP013778.1	Piscirickettsia  salmonis  strain  PM51819A  complete  genome	3141542	39.7401339852
CP007775.1	Campylobacter  lari  NCTC  11845  complete  genome	1791508	29.3615769508
CP015283.1	Streptococcus  salivarius  strain  ATCC  25975  complete  genome	2199793	39.8806160398
CP000712.1	Pseudomonas  putida  F1  complete  genome	5959964	61.8619340654
CP015409.2	Akkermansia  muciniphila  strain  YL44  complete  genome	2745278	55.6615031337
CP005388.1	Campylobacter  jejuni  subsp.  jejuni  CG8421  complete  genome	1636029	30.5108894769
CP012685.1	Serratia  marcescens  strain  SmUNAM836  complete  genome	5207023	59.877957136
CP015951.1	Legionella  pneumophila  strain  E5_N  complete  genome	3419817	38.2954701962
CP010322.1	Bacillus  anthracis  strain  Canadian_bison  complete  genome	5229224	35.3775435896
CP009923.1	Chlamydia  trachomatis  strain  L2b/CS19/08  complete  genome	1038864	41.3283163147
CP001283.1	Bacillus  cereus  AH820  complete  genome	5302683	35.3990423339
CP002643.1	Staphylococcus  aureus  subsp.  aureus  T0131  complete  genome	2913900	32.8028072343
CP001616.1	Tolumonas  auensis  DSM  9187  complete  genome	3471292	49.0270193346
FO203526.1	Vibrio  nigripulchritudo  str.  SFn1  chromosome  complete  genome	4109740	45.8756271686
FO203527.1	Vibrio  nigripulchritudo  str.  SFn1  chromosome  complete  genome	2212415	45.4948551696
CP011317.1	Pseudomonas  aeruginosa  strain  Carb01  63  complete  genome	7497593	65.5967455155
CP010231.1	Escherichia  coli  strain  S30  complete  genome	4664102	50.7375053118
CP010979.1	Pseudomonas  putida  S13.1.2  complete  genome	6621848	62.3403919873
CP006890.1	Bacillus  velezensis  SQR9  complete  genome	4117023	46.0985522792
CP002525.1	Mycoplasma  suis  str.  Illinois  complete  genome	742431	31.0761538783
CP002341.1	Lactobacillus  delbrueckii  subsp.  bulgaricus  ND02  complete  genome	2125753	49.5577331891
CP007133.1	Escherichia  coli  O145:H28  str.  RM12761  complete  genome	5402281	50.666394436
AP014950.1	Klebsiella  pneumoniae  DNA  complete  genome  strain:  YH43	5520319	57.2739546392
CP001078.1	Clostridium  botulinum  E3  str.  Alaska  E43  complete  genome	3659644	27.3612406015
CP011170.1	Bordetella  pertussis  strain  D879  complete  genome	4106400	67.7065799727
CP019450.1	Halioglobus  japonicus  strain  NBRC  107739  complete  genome	4085301	57.6569755815
CP009226.1	Campylobacter  fetus  subsp.  testudinum  strain  pet-3  complete  genome	1776391	33.128573608
FO082820.1	Rhizobium  sp.  NT-26  chromosome  complete  genome	4239731	61.9734365223
CP015209.1	Campylobacter  jejuni  subsp.  jejuni  strain  RM1285  complete  genome	1675112	30.5181384887
CP002774.1	Serratia  sp.  AS12  complete  genome	5443009	55.9614360366
CP002188.1	Mycoplasma  bovis  PG45  clone  MU  clone  A2  complete  genome	1003404	29.3147127179
CP003811.1	Methylobacterium  oryzae  CBMB20  complete  genome	6286629	69.7738167784
CP015385.1	Klebsiella  pneumoniae  strain  NY9  complete  genome	5348589	57.5308366375
CP009679.1	Bacillus  velezensis  strain  JS25R  complete  genome	4006002	46.4036962538
CP017152.1	Acinetobacter  baumannii  DU202  complete  genome	4178958	39.2710096632
CP007591.1	Mycoplasma  bovis  strain  HB0801-P180  complete  genome	977257	29.3008901446
CP000282.1	Saccharophagus  degradans  2-40  complete  genome	5057531	45.8260760043
CP007540.2	Salmonella  enterica  subsp.  enterica  serovar  Montevideo  str.  USDA-ARS-USMARC-1921  complete  genome	4488371	52.3572137865
CP018789.1	Campylobacter  sp.  RM6137  complete  genome	1634523	34.2215435329
CP020000.1	Acinetobacter  calcoaceticus  strain  CA16  complete  genome	4110074	38.7252638274
CP008921.1	Streptococcus  suis  6407  complete  genome	2292360	40.9755448533
CP009273.1	Escherichia  coli  BW25113  complete  genome	4631469	50.7787054172
CP014143.1	Microbulbifer  sp.  CCB-MM1  complete  genome	3864326	58.8510907206
CP017291.1	Corynebacterium  pseudotuberculosis  strain  MEX30  complete  genome	2368140	52.111108296
CP004021.1	Candidatus  Liberibacter  africanus  PTSAPSY  complete  genome	1192232	34.5034355729
CP016440.1	Bordetella  pseudohinzii  strain  HI4681  complete  genome	4490371	66.6395048427
CP019185.1	Salmonella  enterica  subsp.  enterica  serovar  Paratyphi  A  str.  ATCC  11511  complete  genome	4580689	52.2010335126
CP001621.1	Mycoplasma  mycoides  subsp.  capri  str.  GM12  transgenic  clone  tetM-lacZ  complete  genome	1089202	23.923661543
CP003857.1	Streptococcus  intermedius  B196  complete  genome	1996214	37.5569953923
CP020816.1	Lactobacillus  plantarum  strain  LP2  complete  genome	3284622	44.5486269044
BX571857.1	Staphylococcus  aureus  strain  MSSA476  complete  genome	2799802	32.8503587039
CP002992.1	Mycobacterium  tuberculosis  CTRI-2  complete  genome	4398525	65.5992633894
CP013696.1	Pseudomonas  aeruginosa  strain  12-4-4(59)  complete  genome	6431911	66.3476375839
CP012171.1	Arthrobacter  sp.  LS16  complete  genome	3851242	64.3243919754
CP006573.1	Mannheimia  haemolytica  D171  complete  genome	2501382	41.1378989694
CP009565.1	Salmonella  enterica  subsp.  enterica  serovar  Newport  str.  CVM  21554  complete  genome	4726694	52.2540913374
CP009723.1	Yersinia  pestis  strain  Shasta  complete  genome	4659530	47.6213909987
CP004053.1	Bifidobacterium  animalis  subsp.  lactis  Bl12  complete  genome	1938606	60.4837702968
CP015379.1	Hafnia  alvei  strain  HUMV-5920  complete  genome	4542863	48.7852484215
CP007452.1	Eubacterium  acidaminophilum  DSM  3953  complete  genome	2246262	44.0465537858
CP017631.1	Escherichia  coli  SLK172  complete  genome	5283836	50.5917481163
CP008944.1	Corynebacterium  atypicum  strain  R2070  complete  genome	2311380	65.5075322967
CP013699.1	Corynebacterium  pseudotuberculosis  strain  E56  complete  genome	2335773	52.1793855824
CP002163.1	Candidatus  Sulcia  muelleri  CARI  complete  genome	276511	21.1326131691
CP011713.1	Bordetella  pertussis  strain  H884  complete  genome	4109547	67.7037396093
AM398681.2	Flavobacterium  psychrophilum  JIP02/86  complete  genome	2860382	32.5329973409
CP006691.1	Helicobacter  pylori  SouthAfrica20  complete  genome	1622903	38.5684172129
CP012084.1	Bordetella  pertussis  strain  I976  complete  genome	4104251	67.7082371424
CP018842.1	Staphylococcus  epidermidis  strain  14.1.R1  complete  genome	2572575	32.1971565455
CP006009.1	Rickettsia  rickettsii  str.  R  complete  genome	1257005	32.4674921739
CP000837.1	Streptococcus  suis  GZ1  complete  genome	2038034	41.4425372688
CP007442.1	Escherichia  coli  ACN001  complete  genome	4936576	50.6722068089
CP017599.1	Moorea  producens  PAL-8-15-08-1  complete  genome	9673108	43.5184844416
CP016015.1	Neisseria  gonorrhoeae  strain  32867  complete  genome	2218818	52.4123204337
CP002042.1	Meiothermus  silvanus  DSM  9946  complete  genome	3249394	62.3636284181
CP002114.2	Staphylococcus  aureus  subsp.  aureus  JKD6159  complete  genome	2811435	32.8069117728
CP013239.1	Clostridium  butyricum  strain  CDC_51208  complete  genome	3809831	28.8078395078
CP003668.1	Staphylococcus  warneri  SG1  complete  genome	2486042	32.7335177764
CP001712.1	Robiginitalea  biformata  HTCC2501  complete  genome	3530383	55.2932925408
CP009282.1	Paenibacillus  sp.  FSL  R5-0912  complete  genome	7718525	51.0781140179
CP009256.1	Acinetobacter  baumannii  strain  AB031  complete  genome	3803317	39.162473178
CP011341.1	Rhodococcus  aetherivorans  strain  IcdP1  complete  genome	5922748	70.6193645247
CP002843.1	Streptococcus  parasanguinis  ATCC  15912  complete  genome	2153652	41.7244754491
CP010557.1	Raoultella  ornithinolytica  strain  S12  complete  genome	5522044	57.4666373538
CP016029.2	Legionella  pneumophila  strain  Pontiac  complete  genome	3545003	38.3886558065
CP003725.1	Pseudomonas  stutzeri  DSM  10701  complete  genome	4174118	63.2135699087
CP016874.1	Legionella  pneumophila  subsp.  pneumophila  strain  FFI329  complete  genome	3363658	38.3857990319
FO704551.1	Xenorhabdus  poinarii  str.  G6  chromosome  complete  genome	3659523	44.5456689301
CP012979.1	Staphylococcus  aureus  strain  ST20130940  complete  genome	2679642	32.86636797
CP018076.1	Sulfitobacter  sp.  AM1-D1  complete  genome	3840209	64.9028998161
AP011142.1	Acetobacter  pasteurianus  IFO  3283-22  DNA  complete  genome	2907267	53.0374747142
CP015433.1	[Haemophilus]  ducreyi  strain  GHA8  complete  genome	1769925	38.2304334929
CP013128.1	Mycoplasma  sp.  (ex  Biomphalaria  glabrata)  complete  genome	647830	28.4900359662
CP002640.1	Streptococcus  suis  SS12  complete  genome	2096866	41.2358252745
AP010656.1	Candidatus  Azobacteroides  pseudotrichonymphae  genomovar.  CFP2  DNA  complete  genome	1114206	32.6575157556
CP015208.1	Candidatus  Rhodoluna  planktonica  strain  MWH-Dar1  complete  genome	1424506	52.0377590547
CP014064.1	Staphylococcus  aureus  strain  FDAARGOS_159  complete  genome	2801188	32.8856542296
AL157959.1	Neisseria  meningitidis  serogroup  A  strain  Z2491  complete  genome	2184406	51.8091417072
CP020384.1	Rhodovulum  sp.  MB263  complete  genome	3860570	66.9452956429
FN667741.1	Xenorhabdus  bovienii  SS-2004  chromosome  complete  genome	4225498	44.9676227512
CP019430.1	Oxalobacter  formigenes  OXCC13  complete  genome	2433653	49.6046067373
CP001135.1	Edwardsiella  tarda  EIB202  complete  genome	3760463	59.7343997268
CP011729.1	Bordetella  pertussis  strain  I289  complete  genome	4106397	67.7067268459
CP015149.1	Maize  bushy  stunt  phytoplasma  strain  M3  complete  genome	576118	28.462051177
CP016681.1	Neisseria  meningitidis  strain  M08000  complete  genome	2162376	51.7736970814
CP007440.1	Rhodoplanes  sp.  Z2-YC6860  complete  genome	8193889	63.5264402532
CP011759.1	Bordetella  pertussis  strain  J068  complete  genome	4107434	67.7057744568
FN424405.1	Salmonella  enterica  subsp.  enterica  serovar  Typhimurium  str.  D23580  complete  genome	4879400	52.1900848465
CP008936.1	Candidatus  Caedibacter  acanthamoebae  complete  genome	1722347	38.1863817222
CP001509.3	Escherichia  coli  BL21(DE3)  complete  genome	4558953	50.8326144183
CP019596.1	Bifidobacterium  breve  strain  LMC520  complete  genome	2403402	59.0030714795
CP003481.1	Helicobacter  cetorum  MIT  99-5656  complete  genome	1833666	35.5584386688
CP020612.1	Paracoccus  contaminans  strain  RKI  16-01929T=LMG  29738T=CCM  8701T=CIP  111112T  complete  genome	2939512	68.6779302143
CP011612.1	Citrobacter  freundii  strain  CAV1321  complete  genome	4976908	51.7360578094
AP009153.1	Gemmatimonas  aurantiaca  T-27  DNA  complete  genome	4636964	64.2743614141
CP017954.1	Lactobacillus  plantarum  strain  C410L1  complete  genome	3097773	44.8043158747
CP015118.1	Rhizobacter  gummiphilus  strain  NS21  complete  genome	6398096	69.7234614798
CP002695.1	Bordetella  pertussis  CS  complete  genome	4124236	67.7327388636
CP020557.1	Paenibacillus  larvae  subsp.  pulvifaciens  strain  SAG  10367  complete  genome	4666454	44.0933522542
CP002915.1	Bifidobacterium  animalis  subsp.  lactis  CNCM  I-2494  complete  genome	1943113	60.4853654934
CP008989.1	Xanthomonas  citri  subsp.  citri  strain  UI7  complete  genome	5123664	64.8388340844
CP010219.1	Escherichia  coli  strain  M18  complete  genome	5102554	50.617533886
CP003265.1	Synechocystis  sp.  PCC  6803  complete  genome	3569561	47.732284166
HE579061.1	Staphylococcus  aureus  subsp.  aureus  ST228  complete  genome  isolate  10497	2759512	32.8510983101
CP013090.1	Bordetella  pertussis  strain  J191  complete  genome	4111645	67.701686308
CP019415.1	Salmonella  enterica  subsp.  enterica  serovar  Moscow  str.  S-1843  complete  genome	4690402	52.2525361366
CP017962.1	Virgibacillus  halodenitrificans  strain  PDB-F2  complete  genome	3869935	37.488174866
CP011834.1	Limnohabitans  sp.  103DPR2  complete  genome	2948795	53.319474565
CP013537.1	Rhizobium  phaseoli  strain  R630  complete  genome	4398888	61.7080498526
CP011743.1	Bordetella  pertussis  strain  I754  complete  genome	4109174	67.702316816
CP006918.1	Klebsiella  pneumoniae  30684/NJST258_2  complete  genome	5293301	57.4637263213
CP012275.1	Pediococcus  damnosus  strain  TMW  2.1533  complete  genome	2149374	38.2044725581
CP016675.1	Neisseria  meningitidis  strain  M07161  complete  genome	2169790	51.7461136792
CP011662.1	Enterobacter  hormaechei  strain  CAV1176  complete  genome	4878509	55.3670393967
CP002010.1	Bifidobacterium  longum  subsp.  longum  JDM301  complete  genome	2477838	59.8148870104
CP013883.1	Bordetella  pertussis  strain  I093  complete  genome	4101532	67.7083099681
CP018101.1	Delftia  sp.  HK171  complete  genome	6430384	66.889597884
AP014613.1	Alcanivorax  sp.  NBRC  101098  DNA  complete  genome	3095417	54.6620374573
CP016625.1	Escherichia  coli  O157:H7  strain  FRIK944  complete  genome	5770602	50.5876856522
CP010253.1	Bordetella  pertussis  strain  I472  complete  genome	4111652	67.7017412952
CP012371.1	Nitrosospira  briensis  C-128  complete  genome	3210113	53.253140933
CP003508.1	Mycoplasma  gallisepticum  NC96_1596-4-2P  complete  genome	986257	31.6470250655
CP008986.1	Candidatus  Sulcia  muelleri  strain  BGSS  complete  genome	244618	22.4754515203
CP009239.1	Cellulophaga  lytica  strain  HI1  complete  genome	3824196	32.113965916
CP004370.1	Streptomyces  albus  J1074  complete  genome	6841649	73.3212709392
CP015934.1	Legionella  pneumophila  strain  C3_O  complete  genome	3453407	38.3243562082
CP014346.1	Mycoplasma  mycoides  subsp.  mycoides  strain  T1/44  complete  genome	1188848	23.9232433415
CP012410.1	Leptotrichia  sp.  oral  taxon  212  strain  W10393  complete  genome	2444904	31.4137487607
AM946981.2	Escherichia  coli  BL21(DE3)  complete  genome	4558947	50.8326155141
CP005972.1	Mannheimia  haemolytica  D153  complete  genome	2681844	41.0384422062
CP003419.1	Helicobacter  pylori  XZ274  complete  genome	1634138	38.6656451291
CP010412.1	Bifidobacterium  bifidum  strain  BF3  complete  genome	2210370	62.6471133792
CP018766.1	Staphylococcus  aureus  subsp.  aureus  strain  UCI62  complete  genome	2900381	32.8848175464
CP011856.1	Spiroplasma  eriocheiris  strain  DSM  21848  complete  genome	1365714	29.7942321745
CP015750.1	Pectobacterium  wasabiae  CFBP  3304  complete  genome	5043228	50.553316249
CP011686.1	Bacillus  amyloliquefaciens  strain  G341  complete  genome	4009746	46.4936931167
CP000605.1	Bifidobacterium  longum  DJO10A  complete  genome	2375792	60.1460902301
BX897699.1	Bartonella  henselae  strain  Houston-1  complete  genome	1931047	38.230348614
CP007175.1	Salmonella  enterica  subsp.  enterica  serovar  Enteritidis  str.  EC20110354  complete  genome	4711160	52.157239406
CP007288.2	Salmonella  enterica  subsp.  enterica  serovar  Enteritidis  str.  SA19981857  complete  genome	4685848	52.1654351571
CP010912.1	Alteromonas  australica  strain  DE170  complete  genome	4457472	44.8685263755
AP008229.1	Xanthomonas  oryzae  pv.  oryzae  MAFF  311018  DNA  complete  genome	4940217	63.7012908542
CP009941.1	Bacillus  cereus  strain  03BB87  complete  genome	5457398	35.2935959591
CP014322.1	Alteromonas  addita  strain  R10SW13  complete  genome	4649146	43.6098371615
CP008849.1	Alteromonas  australica  strain  H  17  complete  genome	4308833	44.9302862283
CP015120.1	Klebsiella  pneumoniae  strain  kp757  complete  genome	5264852	57.5591298673
CP015125.1	Dokdonia  donghaensis  DSW-1  complete  genome	3293944	38.1716568345
AP017367.1	Leptolyngbya  sp.  O-77  DNA  complete  genome	5480261	55.9272998129
CP013893.1	Bordetella  pertussis  strain  J124  complete  genome	4107607	67.7055765072
CP001357.1	Brachyspira  hyodysenteriae  WA1  complete  genome	3000694	27.0627394863
CP017637.1	Bradyrhizobium  japonicum  strain  J5  complete  genome	10138651	63.3128411265
CP002094.1	Lactococcus  lactis  subsp.  cremoris  NZ9000  complete  genome	2530294	35.7402736599
CP011127.1	Dehalococcoides  mccartyi  strain  11a5  complete  genome	1461973	46.9424537936
HE617159.1	Bacillus  amyloliquefaciens  subsp.  plantarum  CAU  B946  complete  genome	4019861	46.5065085584
CP017155.1	Francisella  tularensis  subsp.  tularensis  strain  NR-21737  complete  genome	1889783	32.2514278094
CP014890.1	Lactobacillus  backii  strain  TMW  1.1992  complete  genome	2548351	40.9041768579
CP018847.1	Xanthomonas  citri  subsp.  citri  strain  LL074-4  complete  genome	5158276	64.8209014019
CP009448.1	Achromobacter  xylosoxidans  C54  complete  genome	6131060	67.9936585191
CP017560.1	Lysinibacillus  sphaericus  strain  LMG  22257  complete  genome	3436578	38.9911417695
CP001341.1	Arthrobacter  chlorophenolicus  A6  complete  genome	4395537	66.2797287339
AP012047.1	Arcobacter  butzleri  ED-1  DNA  complete  genome	2256675	27.0677434721
CP007690.1	Staphylococcus  aureus  strain  UA-S391_USA300  complete  genome	2872916	32.7562657592
CP019593.1	Staphylococcus  aureus  strain  GD705  complete  genome	2832144	32.9234671683
CP014141.1	Thermus  parvatiensis  strain  RL  complete  genome	1872821	68.5418414253
CP003798.1	Chlamydia  psittaci  NJ1  complete  genome	1161434	38.9596825993
FP929140.1	gamma  proteobacterium  HdN1  complete  genome	4587455	53.2585714737
AP008937.1	Lactobacillus  fermentum  IFO  3956  DNA  complete  genome	2098685	51.4690389458
CP020857.1	Cellulosimicrobium  sp.  TH-20  complete  genome	4265546	74.6047516543
CP011324.1	Escherichia  coli  strain  SQ2203  complete  genome	4605301	50.7774193261
CP019963.1	Corynebacterium  stationis  strain  LMG  21670  complete  genome	2871159	54.8267093533
CP018677.1	Acinetobacter  baumannii  strain  LAC4  complete  genome	3974606	39.0224590815
CP014744.1	Campylobacter  jejuni  strain  OD267  complete  genome	1672837	30.5250900118
CP019240.1	Rhodoferax  antarcticus  strain  DSM  24876  complete  genome	3916274	59.0387189456
CP009456.1	Yersinia  enterocolitica  strain  FORC-002  complete  genome	4735534	47.135296674
CP007492.1	Listeria  monocytogenes  strain  NE  dc2014  complete  genome	2904662	38.0376098837
CP015779.1	Bacillus  anthracis  strain  Tangail-1  complete  genome	5227292	35.3759460922
CP010258.1	Bordetella  pertussis  strain  I498  complete  genome	4106502	67.7055070228
CP013083.1	Bordetella  pertussis  strain  H682  complete  genome	4104309	67.7086691085
CP006711.1	Bifidobacterium  breve  12L  complete  genome	2244624	58.8673203173
CP013692.1	Paucibacter  sp.  KCTC  42545  complete  genome	5169161	63.1862114568
CP002491.1	Enterococcus  faecalis  62  complete  genome	2988673	37.4777033152
CP016447.1	Acidovorax  sp.  RAC01  complete  genome	4574859	65.2893783175
CP010125.1	Escherichia  coli  strain  C8  complete  genome	4901865	50.8269403584
CP006631.1	Salmonella  enterica  subsp.  enterica  serovar  Newport  str.  USMARC-S3124.1  complete  genome	4915960	52.1397244892
CP008696.1	Pseudomonas  chlororaphis  strain  PA23  complete  genome	7122173	62.6398853271
CP013196.1	Peptoclostridium  difficile  strain  Z31  complete  genome	4298263	29.219198546
CP010435.1	Helicobacter  pylori  26695-1  complete  genome	1667638	38.8749836595
CP000111.1	Prochlorococcus  marinus  str.  MIT  9312  complete  genome	1709204	31.2104933057
