ID	Description	Length	GC
CP017311.1	Hydrogenophaga  sp.  PBC  complete  genome	5232477	68.3917387501
CP014176.1	Clostridium  argentinense  strain  89G  complete  genome	4662988	28.8483049924
CP000890.1	Coxiella  burnetii  RSA  331  complete  genome	2016427	42.7642061924
CP020448.1	Citrobacter  braakii  strain  FDAARGOS_253  complete  genome	5244065	52.0265099689
CP013031.1	Escherichia  coli  strain  H1827/12  complete  genome	4731493	50.758967624
CP016539.2	Planococcus  plakortidis  strain  DSM  23997  complete  genome	3261818	49.9763935327
CP009423.1	Staphylococcus  aureus  subsp.  aureus  strain  USA300_SUR1  complete  genome	2904778	32.7948297598
CP017996.1	Lactobacillus  crustorum  strain  MN047  complete  genome	2261471	35.0180037683
AL645882.2	Streptomyces  coelicolor  A3(2)  complete  genome	8667507	72.1186611098
CP012355.1	Propionibacterium  acnes  strain  PA_15_1_R1  complete  genome	2493976	60.110161445
CP017070.1	Bacillus  gibsonii  strain  FJAT-10019  complete  genome	4100094	43.8462630369
CP010876.1	Escherichia  coli  strain  MNCRE44  complete  genome	5010884	50.7670303284
CP002031.1	Geobacter  sulfurreducens  KN400  complete  genome	3714272	61.031933041
AL009126.3	Bacillus  subtilis  subsp.  subtilis  str.  168  complete  genome	4215606	43.5144081302
CP013908.1	Streptococcus  agalactiae  strain  GBS-M002  complete  genome	2092570	35.5752973616
CP013990.1	Leclercia  adecarboxylata  strain  USDA-ARS-USMARC-60222  complete  genome	4803917	55.7800436602
HE965806.1	Bordetella  bronchiseptica  253  complete  genome	5264383	68.1178971971
CP013932.1	Alteromonas  sp.  Mac1  complete  genome	4696291	43.5770696492
CP006676.1	Chlamydia  trachomatis  strain  D/13-96  complete  genome	1042752	41.31011017
CP000454.1	Arthrobacter  sp.  FB24  complete  genome	4698945	65.4661631494
AP008934.1	Staphylococcus  saprophyticus  subsp.  saprophyticus  ATCC  15305  DNA  complete  genome	2516575	33.23985973
CP014012.1	Bartonella  bacilliformis  strain  ATCC:35685D-5  complete  genome	1443404	38.2406450308
CP016588.1	Bacillus  thuringiensis  strain  KNU-07  complete  genome	5344151	35.3122507205
CP003039.2	Bifidobacterium  animalis  subsp.  lactis  BLC1  complete  genome	1938583	60.4828887904
CP000472.1	Shewanella  piezotolerans  WP3  complete  genome	5396476	43.2917889378
CP000733.1	Coxiella  burnetii  Dugway  5J108-111  complete  genome	2158758	42.4357894678
FM872308.1	Chlamydia  trachomatis  B/Jali20/OT  complete  genome	1044352	41.2991979716
CP000488.1	Candidatus  Ruthia  magnifica  str.  Cm  (Calyptogena  magnifica)  complete  genome	1160782	34.0334360802
CP019705.1	Corynebacterium  ammoniagenes  strain  KCCM  40472  complete  genome	2808265	55.5395235136
CP012808.1	Acinetobacter  equi  strain  114  complete  genome	3054269	34.892637158
CP006957.1	Mannheimia  haemolytica  USDA-ARS-USMARC-184  complete  genome	2524796	41.0985283564
CP012354.1	Propionibacterium  acnes  strain  PA_12_1_L1  complete  genome	2491961	60.0336441862
CP017249.1	Escherichia  coli  strain  NADC  5570/86-24/6565  complete  genome	5467107	50.4795680787
CP018420.1	Pseudomonas  veronii  strain  R02  complete  genome	6852809	61.0629743219
CP010965.1	Bordetella  pertussis  strain  H321  complete  genome	4079396	67.7081362045
CP012730.1	Bacillus  anthracis  strain  Parent1  complete  genome	5228660	35.3797722552
AP012335.1	Streptococcus  pyogenes  JRS4  DNA  complete  genome	1811124	38.6364489676
AP014521.1	Candidatus  Tachikawaea  gelatinosa  DNA  complete  genome	708439	25.0696249077
CP010855.1	Marinovum  algicola  DG  898  complete  genome	3727131	65.5754520032
CP010966.1	Bordetella  pertussis  strain  I979  complete  genome	4082551	67.7050207089
CP005384.1	Haemophilus  parasuis  ZJ0906  complete  genome	2324740	40.0597916326
CP002534.1	Cellulophaga  lytica  DSM  7489  complete  genome	3765936	32.1109015129
CP003646.1	Gloeocapsa  sp.  PCC  7428  complete  genome	5431448	43.2694375423
CP001157.1	Azotobacter  vinelandii  DJ  complete  genome	5365318	65.675548029
CP018783.1	Curtobacterium  pusillum  strain  AA3  complete  genome	3973750	70.8732557408
CP001726.1	Eggerthella  lenta  DSM  2243  complete  genome	3632260	64.204599891
CP012898.1	Algibacter  sp.  HZ22  complete  genome	3994770	31.8011550102
CP012086.1	Bordetella  pertussis  strain  J013  complete  genome	4105333	67.7077109214
CP011196.1	Bordetella  pertussis  strain  H810  complete  genome	4106384	67.7066246118
CP011736.1	Bordetella  pertussis  strain  I380  complete  genome	4091930	67.6923847671
CP014159.1	Aerococcus  christensenii  strain  CCUG28831  complete  genome	1634920	39.1866268686
CP001964.1	Cellulomonas  flavigena  DSM  20109  complete  genome	4123179	74.2936214993
CP003746.2	Simiduia  agarivorans  SA1  =  DSM  21679  complete  genome	4300227	55.8306573118
CP007434.2	Salmonella  enterica  subsp.  enterica  serovar  Enteritidis  str.  EC20120200  complete  genome	4685848	52.1649016357
CP014641.1	Escherichia  coli  strain  BLK9  complete  genome	4165587	51.030623055
CP002272.1	Enterobacter  lignolyticus  SCF1  complete  genome	4814049	57.0180943318
CP016592.1	Ketogulonicigenium  vulgare  strain  SKV  complete  genome	2764573	61.6900693163
CP014994.1	Salmonella  enterica  subsp.  enterica  serovar  Tennessee  strain  CFSAN001387  complete  genome	4834050	52.1766634602
CP002279.1	Mesorhizobium  opportunistum  WSM2075  complete  genome	6884444	62.8674588681
CP013216.1	Streptococcus  salivarius  strain  HSISS4  complete  genome	2100988	40.2198870246
CP012145.1	Xanthomonas  campestris  pv.  campestris  strain  ICMP  21080  complete  genome	4911121	65.2465903406
CP002081.1	Lactobacillus  helveticus  CNRZ32  complete  genome	2225962	36.9256977433
CP017621.1	Salmonella  enterica  subsp.  enterica  serovar  Typhimurium  strain  22792  complete  genome	4806964	52.1263109106
CP000245.1	Ramlibacter  tataouinensis  TTB310  complete  genome	4070193	69.9967053159
CP019935.1	Streptococcus  thermophilus  strain  APC151  complete  genome	1839134	39.0807303872
CP008742.1	Pseudomonas  savastanoi  pv.  savastanoi  NCPPB  3335  complete  genome	6016828	58.0739386268
CP008857.1	Pseudomonas  aeruginosa  strain  F30658  complete  genome	7273258	65.7593474616
CP008823.1	Enterobacter  cloacae  ECNIH2  complete  genome	4852980	55.463344172
CP019621.1	Listeria  monocytogenes  strain  10-092876-1235  LM8  complete  genome	2966818	37.8451930654
CP013259.1	Buchnera  aphidicola  (Diuraphis  noxia)  complete  genome	636266	25.4715794966
AP012280.1	Pseudomonas  aeruginosa  NCGM2.S1  DNA  complete  genome	6764661	66.143802328
CP021138.1	Sulfuriferula  sp.  AH1  complete  genome	2877007	54.9065400258
CP014429.1	Staphylococcus  aureus  strain  USA300-SUR19  complete  genome	2919828	32.7853558497
CP015589.1	Bacillus  cereus  strain  AR156  complete  genome	5160326	35.4763051792
CP015905.1	Lactococcus  lactis  subsp.  lactis  strain  UC063  complete  genome	2392951	35.3229547951
AP013357.1	Acinetobacter  baumannii  NCGM  237  DNA  complete  genome	4021920	39.1074660858
AM946015.1	Streptococcus  uberis  0140J  complete  genome	1852352	36.6318064817
CP009110.1	Amycolatopsis  methanolica  239  complete  genome	7237391	71.5271981298
CP010263.1	Bordetella  pertussis  strain  I646  complete  genome	4105348	67.7076827592
CP020894.1	Legionella  longbeachae  strain  F1157CHC  complete  genome	4162768	37.1200845207
CP010023.1	Yersinia  pestis  str.  Pestoides  B  complete  genome	4607660	47.6483941958
CP016576.1	Salmonella  enterica  subsp.  enterica  serovar  Heidelberg  strain  AMR588-04-00437  complete  genome	4751454	52.1917291002
CP001219.1	Acidithiobacillus  ferrooxidans  ATCC  23270  complete  genome	2982397	58.772457188
CP002671.1	Chlamydia  trachomatis  RC-F/69  complete  genome	1046087	41.315588474
CP010304.1	Escherichia  coli  O157:H7  str.  SS52  complete  genome	5488700	50.5106127134
CP008985.1	Candidatus  Baumannia  cicadellinicola  strain  BGSS  complete  genome	759425	38.9958192053
CP017018.1	Campylobacter  sp.  RM18020  complete  genome	1705426	30.4332172724
AP009044.1	Corynebacterium  glutamicum  R  DNA  complete  genome	3314179	54.1330447148
CP020931.1	Marinobacter  salarius  strain  SMR5  complete  genome	4386892	57.1723899289
CP015381.1	Desulfococcus  multivorans  strain  DSM  2059  complete  genome	4455399	56.8272112105
CP012082.1	Bordetella  pertussis  strain  I743  complete  genome	4107480	67.7051135976
CP001836.1	Dickeya  dadantii  Ech586  complete  genome	4818394	53.6390755924
CP001962.1	Thermus  scotoductus  SA-01  complete  genome	2346803	64.8850372187
CP009962.1	Collimonas  arenae  strain  Cal35  complete  genome	5603532	56.1476047607
CP012533.1	Psychrobacter  sp.  P11G5  complete  genome	3423795	41.9473128502
CP010792.1	Bacillus  anthracis  strain  Ames  A0462  complete  genome	5227394	35.3786992142
CP009284.1	Paenibacillus  sp.  FSL  R7-0331  complete  genome	6931967	51.2277251176
CP001120.1	Salmonella  enterica  subsp.  enterica  serovar  Heidelberg  str.  SL476  complete  genome	4888768	52.0865584131
CP003939.1	Peptoclostridium  difficile  BJ08  complete  genome	4133893	28.7340044844
CP006841.1	Corynebacterium  lactis  RW2-5  complete  genome	2769745	60.5297960643
CP009676.1	Staphylococcus  schleiferi  strain  5909-02  complete  genome	2528396	35.9397420341
CP003879.1	Psychroflexus  torquis  ATCC  700755  complete  genome	4321832	34.5252892755
CP002082.1	Spiroplasma  mirum  ATCC  29335  complete  genome	1132591	29.4122944646
CP006717.1	Salmonella  enterica  subsp.  enterica  serovar  Thompson  str.  RM6836  complete  genome	4707648	52.2460897671
CP009315.1	Bacillus  anthracis  str.  Turkey32  complete  genome	5228731	35.3771880787
CP011120.1	Acetobacter  sp.  SLV-7  complete  genome	2799488	52.3645395158
CP016474.1	Synechococcus  sp.  PCC  7003  complete  genome	3057091	49.5526302619
CP018804.1	Histophilus  somni  strain  USDA-ARS-USMARC-63368  complete  genome	2183505	37.3874573221
CP016563.1	Salmonella  enterica  subsp.  enterica  serovar  Heidelberg  strain  A3EZ223  complete  genome	4751227	52.1918864327
CP000969.1	Thermotoga  sp.  RQ2  complete  genome	1877693	46.1776765424
CP003678.1	Enterobacter  cloacae  subsp.  dissolvens  SDM  complete  genome	4968248	55.0565511222
AE006470.1	Chlorobium  tepidum  TLS  complete  genome	2154946	56.5296763817
CP009906.1	Yersinia  pestis  Antiqua  complete  genome	4708024	47.7055554517
CP006643.1	Bacillus  infantis  NRRL  B-14911  complete  genome	4884713	46.0332674612
CP012586.1	Flavobacterium  psychrophilum  strain  Z2  complete  genome	4142224	39.049047082
CP012694.1	Neisseria  meningitidis  strain  331401  complete  genome	2191116	51.8607869232
CP010122.1	Escherichia  coli  strain  C5  complete  genome	5333488	50.5654461021
CP000303.1	Bifidobacterium  breve  UCC2003  complete  genome	2422684	58.7331653654
CP020419.1	Neisseria  gonorrhoeae  strain  FDAARGOS_207  complete  genome	2189343	52.3638826808
CP000687.1	Actinobacillus  pleuropneumoniae  serovar  3  str.  JL03  complete  genome	2242062	41.2327580593
CP003099.1	Aggregatibacter  actinomycetemcomitans  ANH9381  complete  genome	2136808	44.4228026102
CP006616.1	Anaplasma  phagocytophilum  str.  HZ2  complete  genome	1477581	41.6450942453
CP009692.1	Bacillus  mycoides  strain  ATCC  6462  complete  genome	5255868	35.4932620073
CP011259.1	Salmonella  enterica  subsp.  enterica  serovar  Agona  str.  460004  2-1  complete  genome	4797171	52.083196534
CP000449.1	Maricaulis  maris  MCS10  complete  genome	3368780	62.7276343365
CP009281.1	Paenibacillus  sp.  FSL  R5-0345  complete  genome	6787172	43.6579182022
CP017020.1	Xanthomonas  citri  subsp.  malvacearum  strain  MSCT  complete  genome	5004182	64.730899076
CP017330.1	Mycoplasma  pneumoniae  strain  549  complete  genome	816492	40.0109247855
CP002953.1	Helicobacter  pylori  ELS37  complete  genome	1664587	38.8858617783
CP001631.1	Acidimicrobium  ferrooxidans  DSM  10331  complete  genome	2158157	68.2893320551
CP015909.1	Lactococcus  lactis  subsp.  cremoris  strain  JM4  complete  genome	2379714	35.8252714402
CP004141.1	Edwardsiella  piscicida  C07-087  complete  genome	3857040	59.6025708834
CP011741.1	Bordetella  pertussis  strain  I728  complete  genome	4107398	67.7051749064
CP013729.1	Roseateles  depolymerans  strain  KCTC  42856  complete  genome	5681722	66.5671956495
CP019229.1	Tessaracoccus  sp.  T2.5-30  complete  genome	3212699	70.3666605555
CP014977.1	Salmonella  enterica  subsp.  enterica  serovar  Typhimurium  str.  USDA-ARS-USMARC-1896  complete  genome	4856440	52.119906763
CP002815.1	Propionibacterium  acnes  6609  complete  genome	2560282	60.0101473197
CP007229.1	Mycoplasma  dispar  strain  ATCC  27140  complete  genome	1084449	29.0401853845
CP002659.1	Sphaerochaeta  coccoides  DSM  17374  complete  genome	2227296	50.5580309038
CP001391.1	Wolbachia  sp.  wRi  complete  genome	1445873	35.1646375581
CP014766.1	Pontibacter  akesuensis  strain  AKS  1T  complete  genome	4713421	51.0011518173
CP006882.1	Synechococcus  sp.  WH  8109  complete  genome	2111515	60.0860993173
AP014951.1	Klebsiella  oxytoca  DNA  complete  genome  strain:  JKo3	5944658	55.6931954706
CP014786.1	Lactobacillus  reuteri  strain  ZLR003  complete  genome	2234097	38.6557521898
CP020102.1	Bacillus  subtilis  strain  NCIB  3610  complete  genome	4215607	43.5144452507
CP012870.1	Escherichia  coli  strain  K-12  substrain  MG1655_TMP32XR2  complete  genome	4641689	50.7904558018
CP015575.1	Campylobacter  hyointestinalis  subsp.  hyointestinalis  LMG  9260  complete  genome	1753385	33.9640181706
CP013781.1	Piscirickettsia  salmonis  strain  PM49811B  complete  genome	3192742	39.7202154136
CP002589.1	Prevotella  denticola  F0289  complete  genome	2937589	50.3606529028
CP021455.1	Comamonas  serinivorans  strain  DSM  26136  complete  genome	4522913	67.9271522578
FR872582.1	Simkania  negevensis  Z  main  chromosome  complete  genome	2496337	41.776811384
CP015114.1	Staphylococcus  condimenti  strain  DSM  11674  complete  genome	2659676	34.7053926869
HG328253.1	Bacillus  amyloliquefaciens  subsp.  plantarum  UCMB5033  complete  genome	4071167	46.1883288011
AP011114.1	Streptococcus  dysgalactiae  subsp.  equisimilis  RE378  DNA  complete  genome	2151145	39.4867849448
CP012069.2	Olsenella  sp.  oral  taxon  807  strain  F0089  complete  genome	3213585	62.0824095208
CP015377.1	Pseudomonas  aeruginosa  strain  BAMCPA07-48  complete  genome	7021552	66.0299745697
CP012384.1	Enterococcus  durans  strain  KLDS  6.0930  complete  genome	2867090	37.9932614602
CP006708.2	Campylobacter  jejuni  subsp.  jejuni  00-2426  complete  genome	1680813	30.5190999832
CP002475.1	Streptomyces  pratensis  ATCC  33331  complete  genome	7337497	71.142311881
CP015401.2	Bacteroides  caecimuris  strain  I48  complete  genome	4839927	42.613369995
CP002006.1	Prevotella  ruminicola  23  complete  genome	3619559	47.6855329613
CP010134.1	Escherichia  coli  strain  D1  complete  genome	5060525	50.6972695521
BA000018.3	Staphylococcus  aureus  subsp.  aureus  N315  DNA  complete  genome	2814816	32.8434966975
CP010242.1	Escherichia  coli  strain  S56  complete  genome	4740150	50.922586838
CP017421.1	Arthrobacter  sp.  ZXY-2  complete  genome	4495402	63.5570078049
CP014759.1	Legionella  pneumophila  strain  F4468  complete  genome	3439438	38.3473404667
CP006656.1	Klebsiella  pneumoniae  JM45  complete  genome	5273813	57.5333255085
CP011125.1	Sandaracinus  amylolyticus  strain  DSM  53668  complete  genome	10327335	72.0359221425
AP013353.1	Mycoplasma  californicum  HAZ160_1  DNA  complete  genome	799088	30.8001121278
CP016827.1	Lactobacillus  helveticus  strain  D76  complete  genome	2058319	37.0354157932
CP016953.1	Streptococcus  himalayensis  strain  HTS2  complete  genome	2275471	41.2697854642
CP013065.1	Peregrinibacteria  bacterium  RIFOXYD1_FULL_PER-ii_59_16  complete  genome	1247854	58.476632683
AE015927.1	Clostridium  tetani  E88  complete  genome	2799251	28.74929758
CP013557.1	Rhizobium  phaseoli  strain  N841  complete  genome	4384120	61.6376832751
CP015753.1	Klebsiella  pneumoniae  strain  W14  complete  genome	5220857	57.4615431911
CP017245.1	Candidatus  Melainabacteria  bacterium  MEL.A1  complete  genome	1867336	32.9473645878
CP017327.1	Mycoplasma  pneumoniae  strain  FH  2009  complete  genome	817275	39.9848276284
CP011538.1	Mycoplasma  hominis  strain  Sprott  complete  genome	695214	27.401490764
CP002299.1	Frankia  sp.  EuI1c  complete  genome	8815781	72.3140014481
CP006704.1	Comamonas  testosteroni  TK102  complete  genome	6062703	61.8722869981
AP012279.1	Bradyrhizobium  sp.  S23321  DNA  complete  genome	7231841	64.2980259107
CP000239.1	Synechococcus  sp.  JA-3-3Ab  complete  genome	2932766	60.2373322659
AP011135.1	Acetobacter  pasteurianus  IFO  3283-07  DNA  complete  genome	2906044	53.0355011831
CP016342.1	Bordetella  parapertussis  strain  H904  complete  genome	4773708	68.1000387958
AP012304.1	Azoarcus  sp.  KH32C  DNA  complete  genome	5081166	65.1013369766
CP014947.1	Pseudomonas  koreensis  strain  D26  complete  genome	6301761	59.5855031633
CP012753.1	Klebsiella  pneumoniae  strain  KP617  complete  genome	5416282	57.4154743051
CP003805.1	Candidatus  Kinetoplastibacterium  oncopeltii  TCC290E  complete  genome	810172	31.2297882425
CP003032.1	Lactobacillus  ruminis  ATCC  27782  complete  genome	2066652	43.469437525
CP018095.1	Chelatococcus  daeguensis  strain  TAD1  complete  genome	3560297	67.8515022764
AP014584.1	Ureaplasma  parvum  serovar  3  DNA  complete  genome  strain:  SV3F4	727289	25.545965909
CP014412.1	Staphylococcus  aureus  strain  USA300-SUR14  complete  genome	2919827	32.7853328297
CP011862.1	Pseudonocardia  sp.  AL041005-10  complete  genome	6143341	74.3548339576
CP011377.1	Moraxella  bovoculi  strain  23343  complete  genome	2184753	45.6866748781
CP014291.1	Acinetobacter  baumannii  strain  AB34299  complete  genome	3882432	39.0049072334
CP000626.1	Vibrio  cholerae  O395  chromosome  1  complete  genome	1108250	46.884457478
CP000627.1	Vibrio  cholerae  O395  chromosome  2  complete  genome	3024069	47.780060574
CP014205.1	Pseudomonas  sp.  MS586  complete  genome	6247726	60.5370017827
CP020837.1	Klebsiella  pneumoniae  strain  BK13043  complete  genome	5594550	57.2362924632
CP005079.1	Erysipelothrix  rhusiopathiae  SY1027  complete  genome	1752910	36.3599956644
CP020595.1	Acinetobacter  baumannii  strain  USA15  complete  genome	3930178	39.1508221765
CP003171.1	Oceanimonas  sp.  GK1  complete  genome	3514537	61.1019602298
CP003479.1	Helicobacter  cetorum  MIT  00-7128  complete  genome	1947646	34.534869273
AP012284.1	Corynebacterium  ulcerans  0102  DNA  complete  genome	2579188	53.3576071229
CP006835.1	Mycobacterium  kansasii  ATCC  12478  complete  genome	6432277	66.2395447211
CP000688.1	Dehalococcoides  sp.  BAV1  complete  genome	1341892	47.1725742459
AP012044.1	Oscillibacter  valericigenes  Sjm18-20  DNA  complete  genome	4410036	53.3211520269
CP000776.1	Campylobacter  hominis  ATCC  BAA-381  complete  genome	1711273	31.733160051
CP016410.1	Salmonella  enterica  subsp.  enterica  serovar  Infantis  strain  N55391  complete  genome	4727114	52.2717878181
FP929003.1	Candidatus  Nitrospira  defluvii  chromosome  complete  genome	4317083	59.0265927248
CP010494.1	Campylobacter  jejuni  strain  CJ677CC059  complete  genome	1632509	30.3883163891
CP017248.1	Streptomyces  puniciscabiei  strain  TW1S1  complete  genome	9698948	71.0888026207
CP007122.1	Lactobacillus  paracasei  N1115  complete  genome	2938059	46.5900106159
CP017723.1	Salmonella  enterica  subsp.  enterica  serovar  Stanleyville  str.  CFSAN000624  strain  SARB61  complete  genome	4888463	52.1343620684
CP015024.1	Salmonella  enterica  subsp.  enterica  serovar  Agona  str.  392869-2  complete  genome	4798530	52.0809706306
CP002526.1	Glaciecola  sp.  4H-3-7+YE-5  complete  genome	5052309	44.174891124
CP016830.1	Xanthomonas  fragariae  isolate  Fap21  complete  genome	4232635	62.2970560892
CP012695.1	Corynebacterium  pseudotuberculosis  strain  PO269-5  complete  genome	2337124	52.1834100373
CP016377.1	Elizabethkingia  genomosp.  4  strain  G4123  complete  genome	4216720	35.6744815876
FP885906.2	Ralstonia  solanacearum  str.  PSI07  chromosome  complete  genome	3520618	66.4389604325
CP010518.3	Pandoraea  apista  strain  TF81F4  complete  genome	5582097	62.644934332
CP021474.1	Pediococcus  pentosaceus  strain  SRCM100892  complete  genome	1785266	37.2385963772
CP001034.1	Natranaerobius  thermophilus  JW/NM-WN-LF  complete  genome	3165557	36.3222965184
CP014525.1	Haematospirillum  jordaniae  strain  H5569  complete  genome	2131542	55.5653606638
CP019592.1	Staphylococcus  aureus  strain  GD5  complete  genome	2784749	32.937402976
CP002183.1	Bacillus  subtilis  subsp.  spizizenii  str.  W23  complete  genome	4027676	43.8906456229
CP011171.1	Bordetella  pertussis  strain  E150  complete  genome	4104313	67.7087493083
AP014648.1	Methyloceanibacter  caenitepidi  DNA  complete  genome  strain:  Gela4	3424964	62.842324766
FR873482.1	Streptococcus  salivarius  JIM8777  complete  genome	2210574	40.0691404133
CP003992.2	Clostridium  stercorarium  subsp.  stercorarium  DSM  8532  complete  genome	2970010	42.2549419026
CP006018.1	Bifidobacterium  indicum  LMG  11587  =  DSM  20214  complete  genome	1734546	60.4933509979
CP015243.1	Halotalea  alkalilenta  strain  IHB  B  13600  complete  genome	4387428	64.314217806
CP006913.1	Candidate  division  SR1  bacterium  RAAC1_SR1_1  complete  genome	1177760	31.0591291944
CP019469.1	Clostridioides  difficile  strain  LEM1  complete  genome	4191506	28.7675360598
BX548175.1	Prochlorococcus  marinus  MIT9313  complete  genome	2410873	50.7397527784
CP016159.1	Klebsiella  pneumoniae  strain  TH1  complete  genome	5220846	57.4615110271
CP021505.1	Bacillus  amyloliquefaciens  strain  SRCM101267  complete  genome	4070574	45.9411866729
AE013218.1	Buchnera  aphidicola  str.  Sg  (Schizaphis  graminum)  complete  genome	641454	25.3305770952
CP001666.1	Clostridium  ljungdahlii  DSM  13528  complete  genome	4630065	31.1059347979
AE001437.1	Clostridium  acetobutylicum  ATCC  824  complete  genome	3940880	30.9257830738
CP014945.1	Psychrobacter  alimentarius  strain  PAMC  27889  complete  genome	3332539	42.8756872763
CP013341.1	Nitrosomonas  ureae  strain  Nm10  complete  genome	3307820	44.4831943697
CP007436.1	Bacillus  pumilus  strain  MTCC  B6033  complete  genome	3763493	41.3663051851
CP010504.1	Campylobacter  jejuni  strain  CJ677CC085  complete  genome	1636377	30.3733186179
CP001685.1	Leptotrichia  buccalis  DSM  1135  complete  genome	2465610	29.6456860574
CP000802.1	Escherichia  coli  HS  complete  genome	4643538	50.8196121147
CP020889.1	Xanthomonas  citri  subsp.  citri  strain  TX160197  complete  genome	5337525	64.6973269446
CP011210.1	Microgenomates  (Beckwithbacteria)  bacterium  GW2011_GWC1_49_16  complete  genome	1049888	48.9223612423
CP013246.1	Clostridium  botulinum  strain  CDC_69094  complete  genome	4089027	28.142783112
CP014262.1	Pseudomonas  corrugata  strain  RM1-1-4  complete  genome	6124363	60.6573287704
CP009283.1	Paenibacillus  sp.  FSL  R7-0273  complete  genome	7288921	51.8997805025
CP006975.1	Chlamydia  muridarum  str.  Nigg  CM972  complete  genome	1072952	40.3366599811
CP013091.1	Bordetella  pertussis  strain  J192  complete  genome	4112694	67.7008063328
CP010459.1	Campylobacter  jejuni  strain  CJ677CC047  complete  genome	1635237	30.3732731096
CP013838.1	Streptococcus  pyogenes  strain  MGAS11027  complete  genome	1786874	38.5512912494
CP019221.1	Mycobacterium  chimaera  strain  CDC  2015-22-71  complete  genome	6078402	67.6018302179
CP000507.1	Shewanella  amazonensis  SB2B  complete  genome	4306142	53.58638893
CP013126.1	Propionibacterium  acidipropionici  strain  CGMCC  1.2230  complete  genome	3651382	68.7668121276
CP007389.1	Thermosipho  melanesiensis  strain  431  complete  genome	1915344	31.3980673968
CP011301.1	Burkholderia  cepacia  strain  LO6  complete  genome	6419376	66.9921967493
CP007766.1	Campylobacter  peloridis  LMG  23910  complete  genome	1711369	28.5146569793
CP005990.1	Spiribacter  curvatus  strain  UAH-SP71  complete  genome	1926631	63.8574278105
CP009247.1	Corynebacterium  frankenforstense  DSM  45800  strain  ST18  complete  genome	2604152	71.5065787251
CP006833.1	Campylobacter  fetus  subsp.  testudinum  03-427  complete  genome	1775480	33.1232117512
CP013601.1	Rhizobium  sp.  N731  complete  genome	4347393	61.4368197216
CP006048.1	Salmonella  enterica  subsp.  enterica  serovar  Typhimurium  var.  5-  str.  CFSAN001921  complete  genome	4859931	52.1734773601
CP004035.1	Chlamydia  pecorum  P787  complete  genome	1106409	41.1036063517
CP015423.1	Paenibacillus  polymyxa  strain  J  complete  genome	5756938	45.7350417878
CP003355.1	Paenibacillus  larvae  subsp.  larvae  DSM  25430  complete  genome	4046337	44.9821900647
CP016464.1	Bosea  sp.  RAC05  complete  genome	4911382	68.3962477364
CP003557.1	Melioribacter  roseus  P3M  complete  genome	3300414	41.32811823
CP007160.1	Listeria  monocytogenes  WSLC1001  complete  genome	2951235	37.960989213
CP014982.2	Salmonella  enterica  subsp.  enterica  serovar  Typhimurium  str.  USDA-ARS-USMARC-1810  complete  genome	4927145	52.162073574
CP009426.1	Mycobacterium  tuberculosis  strain  96075  complete  genome	4379376	65.5773105575
CP009495.1	Mycobacterium  smegmatis  strain  INHR1  complete  genome	6988337	67.4029601034
CP005929.1	Actinoplanes  sp.  N902-109  complete  genome	9228054	71.3110803209
CP021079.1	Alcaligenes  faecalis  strain  P156  complete  genome	4047508	56.6640510655
CP015064.1	Mesorhizobium  ciceri  biovar  biserrulae  strain  WSM1284  complete  genome	6326813	62.651733187
AP009351.1	Staphylococcus  aureus  subsp.  aureus  str.  Newman  DNA  complete  genome	2878897	32.8882554673
